Sheet: ADD
A1: Implementation | B1: Iterations | C1: Time per op | E1: Time per iter | H1: 100 | I1: 1K | J1: 10K | K1: 100K | L1: 1M
A2: AGRONA | B2: 100 | C2: 398.636 | E2: of:=[.C2] / [.B2] -> 3.98636 | G2: AGRONA | H2: of:=[.E2] -> 3.98636 | I2: of:=[.E10] -> 3.395867 | J2: of:=[.E18] -> 3.4018067 | K2: of:=[.E26] -> 6.21342519 | L2: of:=[.E34] -> 5.884157592
A3: ECLIPSE | B3: 100 | C3: 498.09 | E3: of:=[.C3] / [.B3] -> 4.9809 | G3: ECLIPSE | H3: of:=[.E3] -> 4.9809 | I3: of:=[.E11] -> 4.594253 | J3: of:=[.E19] -> 4.6411412 | K3: of:=[.E27] -> 4.64952397 | L3: of:=[.E35] -> 4.108055095
A4: FASTUTIL | B4: 100 | C4: 423.881 | E4: of:=[.C4] / [.B4] -> 4.23881 | G4: FASTUTIL | H4: of:=[.E4] -> 4.23881 | I4: of:=[.E12] -> 3.67548 | J4: of:=[.E20] -> 3.6970854 | K4: of:=[.E28] -> 3.88045401 | L4: of:=[.E36] -> 2.906035473
A5: GDX | B5: 100 | C5: 310.083 | E5: of:=[.C5] / [.B5] -> 3.10083 | G5: GDX | H5: of:=[.E5] -> 3.10083 | I5: of:=[.E13] -> 2.554719 | J5: of:=[.E21] -> 2.4650698 | K5: of:=[.E29] -> 2.47642536 | L5: of:=[.E37] -> 2.497118442
A6: JDK | B6: 100 | C6: 663.871 | E6: of:=[.C6] / [.B6] -> 6.63871 | G6: JDK | H6: of:=[.E6] -> 6.63871 | I6: of:=[.E14] -> 5.642367 | J6: of:=[.E22] -> 6.7238449 | K6: of:=[.E30] -> 7.2750419 | L6: of:=[.E38] -> 6.905521095
A7: KOLOBOKE | B7: 100 | C7: 477.092 | E7: of:=[.C7] / [.B7] -> 4.77092 | G7: KOLOBOKE | H7: of:=[.E7] -> 4.77092 | I7: of:=[.E15] -> 4.381381 | J7: of:=[.E23] -> 4.2586368 | K7: of:=[.E31] -> 4.97686582 | L7: of:=[.E39] -> 5.619940236
A8: MERRY | B8: 100 | C8: 370.311 | E8: of:=[.C8] / [.B8] -> 3.70311 | G8: MERRY | H8: of:=[.E8] -> 3.70311 | I8: of:=[.E16] -> 3.282242 | J8: of:=[.E24] -> 3.2591665 | K8: of:=[.E32] -> 3.4872712 | L8: of:=[.E40] -> 3.390907348
A9: TROVE | B9: 100 | C9: 506.299 | E9: of:=[.C9] / [.B9] -> 5.06299 | G9: TROVE | H9: of:=[.E9] -> 5.06299 | I9: of:=[.E17] -> 4.649973 | J9: of:=[.E25] -> 4.9280691 | K9: of:=[.E33] -> 5.34628521 | L9: of:=[.E41] -> 4.137587854
A10: AGRONA | B10: 1000 | C10: 3395.867 | E10: of:=[.C10] / [.B10] -> 3.395867
A11: ECLIPSE | B11: 1000 | C11: 4594.253 | E11: of:=[.C11] / [.B11] -> 4.594253
A12: FASTUTIL | B12: 1000 | C12: 3675.48 | E12: of:=[.C12] / [.B12] -> 3.67548
A13: GDX | B13: 1000 | C13: 2554.719 | E13: of:=[.C13] / [.B13] -> 2.554719
A14: JDK | B14: 1000 | C14: 5642.367 | E14: of:=[.C14] / [.B14] -> 5.642367
A15: KOLOBOKE | B15: 1000 | C15: 4381.381 | E15: of:=[.C15] / [.B15] -> 4.381381
A16: MERRY | B16: 1000 | C16: 3282.242 | E16: of:=[.C16] / [.B16] -> 3.282242
A17: TROVE | B17: 1000 | C17: 4649.973 | E17: of:=[.C17] / [.B17] -> 4.649973
A18: AGRONA | B18: 10000 | C18: 34018.067 | E18: of:=[.C18] / [.B18] -> 3.4018067
A19: ECLIPSE | B19: 10000 | C19: 46411.412 | E19: of:=[.C19] / [.B19] -> 4.6411412
A20: FASTUTIL | B20: 10000 | C20: 36970.854 | E20: of:=[.C20] / [.B20] -> 3.6970854
A21: GDX | B21: 10000 | C21: 24650.698 | E21: of:=[.C21] / [.B21] -> 2.4650698
A22: JDK | B22: 10000 | C22: 67238.449 | E22: of:=[.C22] / [.B22] -> 6.7238449
A23: KOLOBOKE | B23: 10000 | C23: 42586.368 | E23: of:=[.C23] / [.B23] -> 4.2586368
A24: MERRY | B24: 10000 | C24: 32591.665 | E24: of:=[.C24] / [.B24] -> 3.2591665
A25: TROVE | B25: 10000 | C25: 49280.691 | E25: of:=[.C25] / [.B25] -> 4.9280691
A26: AGRONA | B26: 100000 | C26: 621342.519 | E26: of:=[.C26] / [.B26] -> 6.21342519
A27: ECLIPSE | B27: 100000 | C27: 464952.397 | E27: of:=[.C27] / [.B27] -> 4.64952397
A28: FASTUTIL | B28: 100000 | C28: 388045.401 | E28: of:=[.C28] / [.B28] -> 3.88045401
A29: GDX | B29: 100000 | C29: 247642.536 | E29: of:=[.C29] / [.B29] -> 2.47642536
A30: JDK | B30: 100000 | C30: 727504.19 | E30: of:=[.C30] / [.B30] -> 7.2750419
A31: KOLOBOKE | B31: 100000 | C31: 497686.582 | E31: of:=[.C31] / [.B31] -> 4.97686582
A32: MERRY | B32: 100000 | C32: 348727.12 | E32: of:=[.C32] / [.B32] -> 3.4872712
A33: TROVE | B33: 100000 | C33: 534628.521 | E33: of:=[.C33] / [.B33] -> 5.34628521
A34: AGRONA | B34: 1000000 | C34: 5884157.592 | E34: of:=[.C34] / [.B34] -> 5.884157592
A35: ECLIPSE | B35: 1000000 | C35: 4108055.095 | E35: of:=[.C35] / [.B35] -> 4.108055095
A36: FASTUTIL | B36: 1000000 | C36: 2906035.473 | E36: of:=[.C36] / [.B36] -> 2.906035473
A37: GDX | B37: 1000000 | C37: 2497118.442 | E37: of:=[.C37] / [.B37] -> 2.497118442
A38: JDK | B38: 1000000 | C38: 6905521.095 | E38: of:=[.C38] / [.B38] -> 6.905521095
A39: KOLOBOKE | B39: 1000000 | C39: 5619940.236 | E39: of:=[.C39] / [.B39] -> 5.619940236
A40: MERRY | B40: 1000000 | C40: 3390907.348 | E40: of:=[.C40] / [.B40] -> 3.390907348
A41: TROVE | B41: 1000000 | C41: 4137587.854 | E41: of:=[.C41] / [.B41] -> 4.137587854

Sheet: ADD_OR_REMOVE
A1: Implementation | B1: Iterations | C1: Time per op | E1: Time per iter | H1: 100 | I1: 1K | J1: 10K | K1: 100K | L1: 1M
A2: AGRONA | B2: 100 | C2: 401.083 | E2: of:=[.C2] / [.B2] -> 4.01083 | G2: AGRONA | H2: of:=[.E2] -> 4.01083 | I2: of:=[.E10] -> 3.064452 | J2: of:=[.E18] -> 3.0423464 | K2: of:=[.E26] -> 3.04019037 | L2: of:=[.E34] -> 3.051874762
A3: ECLIPSE | B3: 100 | C3: 430.779 | E3: of:=[.C3] / [.B3] -> 4.30779 | G3: ECLIPSE | H3: of:=[.E3] -> 4.30779 | I3: of:=[.E11] -> 3.717619 | J3: of:=[.E19] -> 3.5800055 | K3: of:=[.E27] -> 3.54831784 | L3: of:=[.E35] -> 3.5852223
A4: FASTUTIL | B4: 100 | C4: 444.852 | E4: of:=[.C4] / [.B4] -> 4.44852 | G4: FASTUTIL | H4: of:=[.E4] -> 4.44852 | I4: of:=[.E12] -> 3.442378 | J4: of:=[.E20] -> 3.3825775 | K4: of:=[.E28] -> 3.36231029 | L4: of:=[.E36] -> 3.362331798
A5: GDX | B5: 100 | C5: 631.485 | E5: of:=[.C5] / [.B5] -> 6.31485 | G5: GDX | H5: of:=[.E5] -> 6.31485 | I5: of:=[.E13] -> 5.814075 | J5: of:=[.E21] -> 5.8720583 | K5: of:=[.E29] -> 5.9180466 | L5: of:=[.E37] -> 5.267131763
A6: JDK | B6: 100 | C6: 802.08 | E6: of:=[.C6] / [.B6] -> 8.0208 | G6: JDK | H6: of:=[.E6] -> 8.0208 | I6: of:=[.E14] -> 6.384868 | J6: of:=[.E22] -> 6.0970033 | K6: of:=[.E30] -> 6.18345992 | L6: of:=[.E38] -> 6.243186634
A7: KOLOBOKE | B7: 100 | C7: 442.857 | E7: of:=[.C7] / [.B7] -> 4.42857 | G7: KOLOBOKE | H7: of:=[.E7] -> 4.42857 | I7: of:=[.E15] -> 3.58112 | J7: of:=[.E23] -> 3.5487642 | K7: of:=[.E31] -> 3.55097099 | L7: of:=[.E39] -> 3.557341551
A8: MERRY | B8: 100 | C8: 483.022 | E8: of:=[.C8] / [.B8] -> 4.83022 | G8: MERRY | H8: of:=[.E8] -> 4.83022 | I8: of:=[.E16] -> 3.647465 | J8: of:=[.E24] -> 3.7642181 | K8: of:=[.E32] -> 3.75379585 | L8: of:=[.E40] -> 3.728506758
A9: TROVE | B9: 100 | C9: 2284.125 | E9: of:=[.C9] / [.B9] -> 22.84125 | G9: TROVE | H9: of:=[.E9] -> 22.84125 | I9: of:=[.E17] -> 20.223476 | J9: of:=[.E25] -> 21.2970184 | K9: of:=[.E33] -> 21.32254147 | L9: of:=[.E41] -> 21.39009053
A10: AGRONA | B10: 1000 | C10: 3064.452 | E10: of:=[.C10] / [.B10] -> 3.064452
A11: ECLIPSE | B11: 1000 | C11: 3717.619 | E11: of:=[.C11] / [.B11] -> 3.717619
A12: FASTUTIL | B12: 1000 | C12: 3442.378 | E12: of:=[.C12] / [.B12] -> 3.442378
A13: GDX | B13: 1000 | C13: 5814.075 | E13: of:=[.C13] / [.B13] -> 5.814075
A14: JDK | B14: 1000 | C14: 6384.868 | E14: of:=[.C14] / [.B14] -> 6.384868
A15: KOLOBOKE | B15: 1000 | C15: 3581.12 | E15: of:=[.C15] / [.B15] -> 3.58112
A16: MERRY | B16: 1000 | C16: 3647.465 | E16: of:=[.C16] / [.B16] -> 3.647465
A17: TROVE | B17: 1000 | C17: 20223.476 | E17: of:=[.C17] / [.B17] -> 20.223476
A18: AGRONA | B18: 10000 | C18: 30423.464 | E18: of:=[.C18] / [.B18] -> 3.0423464
A19: ECLIPSE | B19: 10000 | C19: 35800.055 | E19: of:=[.C19] / [.B19] -> 3.5800055
A20: FASTUTIL | B20: 10000 | C20: 33825.775 | E20: of:=[.C20] / [.B20] -> 3.3825775
A21: GDX | B21: 10000 | C21: 58720.583 | E21: of:=[.C21] / [.B21] -> 5.8720583
A22: JDK | B22: 10000 | C22: 60970.033 | E22: of:=[.C22] / [.B22] -> 6.0970033
A23: KOLOBOKE | B23: 10000 | C23: 35487.642 | E23: of:=[.C23] / [.B23] -> 3.5487642
A24: MERRY | B24: 10000 | C24: 37642.181 | E24: of:=[.C24] / [.B24] -> 3.7642181
A25: TROVE | B25: 10000 | C25: 212970.184 | E25: of:=[.C25] / [.B25] -> 21.2970184
A26: AGRONA | B26: 100000 | C26: 304019.037 | E26: of:=[.C26] / [.B26] -> 3.04019037
A27: ECLIPSE | B27: 100000 | C27: 354831.784 | E27: of:=[.C27] / [.B27] -> 3.54831784
A28: FASTUTIL | B28: 100000 | C28: 336231.029 | E28: of:=[.C28] / [.B28] -> 3.36231029
A29: GDX | B29: 100000 | C29: 591804.66 | E29: of:=[.C29] / [.B29] -> 5.9180466
A30: JDK | B30: 100000 | C30: 618345.992 | E30: of:=[.C30] / [.B30] -> 6.18345992
A31: KOLOBOKE | B31: 100000 | C31: 355097.099 | E31: of:=[.C31] / [.B31] -> 3.55097099
A32: MERRY | B32: 100000 | C32: 375379.585 | E32: of:=[.C32] / [.B32] -> 3.75379585
A33: TROVE | B33: 100000 | C33: 2132254.147 | E33: of:=[.C33] / [.B33] -> 21.32254147
A34: AGRONA | B34: 1000000 | C34: 3051874.762 | E34: of:=[.C34] / [.B34] -> 3.051874762
A35: ECLIPSE | B35: 1000000 | C35: 3585222.3 | E35: of:=[.C35] / [.B35] -> 3.5852223
A36: FASTUTIL | B36: 1000000 | C36: 3362331.798 | E36: of:=[.C36] / [.B36] -> 3.362331798
A37: GDX | B37: 1000000 | C37: 5267131.763 | E37: of:=[.C37] / [.B37] -> 5.267131763
A38: JDK | B38: 1000000 | C38: 6243186.634 | E38: of:=[.C38] / [.B38] -> 6.243186634
A39: KOLOBOKE | B39: 1000000 | C39: 3557341.551 | E39: of:=[.C39] / [.B39] -> 3.557341551
A40: MERRY | B40: 1000000 | C40: 3728506.758 | E40: of:=[.C40] / [.B40] -> 3.728506758
A41: TROVE | B41: 1000000 | C41: 21390090.53 | E41: of:=[.C41] / [.B41] -> 21.39009053

Sheet: ADD_THEN_REMOVE
A1: Implementation | B1: Iterations | C1: Time per op | E1: Time per iter | H1: 100 | I1: 1K | J1: 10K | K1: 100K | L1: 1M
A2: AGRONA | B2: 100 | C2: 673.805 | E2: of:=[.C2] / [.B2] -> 6.73805 | G2: AGRONA | H2: of:=[.E2] -> 6.73805 | I2: of:=[.E10] -> 5.744003 | J2: of:=[.E18] -> 5.0728286 | K2: of:=[.E26] -> 8.50006327 | L2: of:=[.E34] -> 8.266291649
A3: ECLIPSE | B3: 100 | C3: 805.182 | E3: of:=[.C3] / [.B3] -> 8.05182 | G3: ECLIPSE | H3: of:=[.E3] -> 8.05182 | I3: of:=[.E11] -> 7.041425 | J3: of:=[.E19] -> 6.2581008 | K3: of:=[.E27] -> 7.00932547 | L3: of:=[.E35] -> 7.001536655
A4: FASTUTIL | B4: 100 | C4: 720.704 | E4: of:=[.C4] / [.B4] -> 7.20704 | G4: FASTUTIL | H4: of:=[.E4] -> 7.20704 | I4: of:=[.E12] -> 5.191565 | J4: of:=[.E20] -> 5.261698 | K4: of:=[.E28] -> 5.20517413 | L4: of:=[.E36] -> 5.363782923
A5: GDX | B5: 100 | C5: 998.687 | E5: of:=[.C5] / [.B5] -> 9.98687 | G5: GDX | H5: of:=[.E5] -> 9.98687 | I5: of:=[.E13] -> 9.586415 | J5: of:=[.E21] -> 9.2695965 | K5: of:=[.E29] -> 9.59397299 | L5: of:=[.E37] -> 10.467981254
A6: JDK | B6: 100 | C6: 1021.551 | E6: of:=[.C6] / [.B6] -> 10.21551 | G6: JDK | H6: of:=[.E6] -> 10.21551 | I6: of:=[.E14] -> 9.286802 | J6: of:=[.E22] -> 9.6696318 | K6: of:=[.E30] -> 10.22193163 | L6: of:=[.E38] -> 10.291225146
A7: KOLOBOKE | B7: 100 | C7: 636.266 | E7: of:=[.C7] / [.B7] -> 6.36266 | G7: KOLOBOKE | H7: of:=[.E7] -> 6.36266 | I7: of:=[.E15] -> 5.421231 | J7: of:=[.E23] -> 6.1553872 | K7: of:=[.E31] -> 9.33022256 | L7: of:=[.E39] -> 9.285972283
A8: MERRY | B8: 100 | C8: 729.723 | E8: of:=[.C8] / [.B8] -> 7.29723 | G8: MERRY | H8: of:=[.E8] -> 7.29723 | I8: of:=[.E16] -> 6.549749 | J8: of:=[.E24] -> 5.8281875 | K8: of:=[.E32] -> 5.85299654 | L8: of:=[.E40] -> 5.833382035
A9: TROVE | B9: 100 | C9: 1026.299 | E9: of:=[.C9] / [.B9] -> 10.26299 | G9: TROVE | H9: of:=[.E9] -> 10.26299 | I9: of:=[.E17] -> 9.2895 | J9: of:=[.E25] -> 8.5607981 | K9: of:=[.E33] -> 8.33870786 | L9: of:=[.E41] -> 8.234117809
A10: AGRONA | B10: 1000 | C10: 5744.003 | E10: of:=[.C10] / [.B10] -> 5.744003
A11: ECLIPSE | B11: 1000 | C11: 7041.425 | E11: of:=[.C11] / [.B11] -> 7.041425
A12: FASTUTIL | B12: 1000 | C12: 5191.565 | E12: of:=[.C12] / [.B12] -> 5.191565
A13: GDX | B13: 1000 | C13: 9586.415 | E13: of:=[.C13] / [.B13] -> 9.586415
A14: JDK | B14: 1000 | C14: 9286.802 | E14: of:=[.C14] / [.B14] -> 9.286802
A15: KOLOBOKE | B15: 1000 | C15: 5421.231 | E15: of:=[.C15] / [.B15] -> 5.421231
A16: MERRY | B16: 1000 | C16: 6549.749 | E16: of:=[.C16] / [.B16] -> 6.549749
A17: TROVE | B17: 1000 | C17: 9289.5 | E17: of:=[.C17] / [.B17] -> 9.2895
A18: AGRONA | B18: 10000 | C18: 50728.286 | E18: of:=[.C18] / [.B18] -> 5.0728286
A19: ECLIPSE | B19: 10000 | C19: 62581.008 | E19: of:=[.C19] / [.B19] -> 6.2581008
A20: FASTUTIL | B20: 10000 | C20: 52616.98 | E20: of:=[.C20] / [.B20] -> 5.261698
A21: GDX | B21: 10000 | C21: 92695.965 | E21: of:=[.C21] / [.B21] -> 9.2695965
A22: JDK | B22: 10000 | C22: 96696.318 | E22: of:=[.C22] / [.B22] -> 9.6696318
A23: KOLOBOKE | B23: 10000 | C23: 61553.872 | E23: of:=[.C23] / [.B23] -> 6.1553872
A24: MERRY | B24: 10000 | C24: 58281.875 | E24: of:=[.C24] / [.B24] -> 5.8281875
A25: TROVE | B25: 10000 | C25: 85607.981 | E25: of:=[.C25] / [.B25] -> 8.5607981
A26: AGRONA | B26: 100000 | C26: 850006.327 | E26: of:=[.C26] / [.B26] -> 8.50006327
A27: ECLIPSE | B27: 100000 | C27: 700932.547 | E27: of:=[.C27] / [.B27] -> 7.00932547
A28: FASTUTIL | B28: 100000 | C28: 520517.413 | E28: of:=[.C28] / [.B28] -> 5.20517413
A29: GDX | B29: 100000 | C29: 959397.299 | E29: of:=[.C29] / [.B29] -> 9.59397299
A30: JDK | B30: 100000 | C30: 1022193.163 | E30: of:=[.C30] / [.B30] -> 10.22193163
A31: KOLOBOKE | B31: 100000 | C31: 933022.256 | E31: of:=[.C31] / [.B31] -> 9.33022256
A32: MERRY | B32: 100000 | C32: 585299.654 | E32: of:=[.C32] / [.B32] -> 5.85299654
A33: TROVE | B33: 100000 | C33: 833870.786 | E33: of:=[.C33] / [.B33] -> 8.33870786
A34: AGRONA | B34: 1000000 | C34: 8266291.649 | E34: of:=[.C34] / [.B34] -> 8.266291649
A35: ECLIPSE | B35: 1000000 | C35: 7001536.655 | E35: of:=[.C35] / [.B35] -> 7.001536655
A36: FASTUTIL | B36: 1000000 | C36: 5363782.923 | E36: of:=[.C36] / [.B36] -> 5.363782923
A37: GDX | B37: 1000000 | C37: 10467981.254 | E37: of:=[.C37] / [.B37] -> 10.467981254
A38: JDK | B38: 1000000 | C38: 10291225.146 | E38: of:=[.C38] / [.B38] -> 10.291225146
A39: KOLOBOKE | B39: 1000000 | C39: 9285972.283 | E39: of:=[.C39] / [.B39] -> 9.285972283
A40: MERRY | B40: 1000000 | C40: 5833382.035 | E40: of:=[.C40] / [.B40] -> 5.833382035
A41: TROVE | B41: 1000000 | C41: 8234117.809 | E41: of:=[.C41] / [.B41] -> 8.234117809

Sheet: CONTAINS
A1: Implementation | B1: Iterations | C1: Time per op | E1: Time per iter | H1: 100 | I1: 1K | J1: 10K | K1: 100K | L1: 1M
A2: AGRONA | B2: 100 | C2: 353.749 | E2: of:=[.C2] / [.B2] -> 3.53749 | G2: AGRONA | H2: of:=[.E2] -> 3.53749 | I2: of:=[.E10] -> 2.850197 | J2: of:=[.E18] -> 2.9694619 | K2: of:=[.E26] -> 5.28706129 | L2: of:=[.E34] -> 5.960755159
A3: ECLIPSE | B3: 100 | C3: 463.114 | E3: of:=[.C3] / [.B3] -> 4.63114 | G3: ECLIPSE | H3: of:=[.E3] -> 4.63114 | I3: of:=[.E11] -> 3.940936 | J3: of:=[.E19] -> 3.9374636 | K3: of:=[.E27] -> 4.03018145 | L3: of:=[.E35] -> 3.686695872
A4: FASTUTIL | B4: 100 | C4: 407.514 | E4: of:=[.C4] / [.B4] -> 4.07514 | G4: FASTUTIL | H4: of:=[.E4] -> 4.07514 | I4: of:=[.E12] -> 3.574486 | J4: of:=[.E20] -> 3.587947 | K4: of:=[.E28] -> 3.13881404 | L4: of:=[.E36] -> 2.745577311
A5: GDX | B5: 100 | C5: 331.211 | E5: of:=[.C5] / [.B5] -> 3.31211 | G5: GDX | H5: of:=[.E5] -> 3.31211 | I5: of:=[.E13] -> 2.789153 | J5: of:=[.E21] -> 2.7658501 | K5: of:=[.E29] -> 2.82704741 | L5: of:=[.E37] -> 2.438373959
A6: JDK | B6: 100 | C6: 418.356 | E6: of:=[.C6] / [.B6] -> 4.18356 | G6: JDK | H6: of:=[.E6] -> 4.18356 | I6: of:=[.E14] -> 3.759938 | J6: of:=[.E22] -> 3.8596228 | K6: of:=[.E30] -> 4.44287048 | L6: of:=[.E38] -> 4.627267397
A7: KOLOBOKE | B7: 100 | C7: 335.064 | E7: of:=[.C7] / [.B7] -> 3.35064 | G7: KOLOBOKE | H7: of:=[.E7] -> 3.35064 | I7: of:=[.E15] -> 2.807607 | J7: of:=[.E23] -> 2.7576611 | K7: of:=[.E31] -> 5.11958087 | L7: of:=[.E39] -> 5.658474711
A8: MERRY | B8: 100 | C8: 371.142 | E8: of:=[.C8] / [.B8] -> 3.71142 | G8: MERRY | H8: of:=[.E8] -> 3.71142 | I8: of:=[.E16] -> 3.155029 | J8: of:=[.E24] -> 3.1526056 | K8: of:=[.E32] -> 3.43761813 | L8: of:=[.E40] -> 2.911223659
A9: TROVE | B9: 100 | C9: 477.873 | E9: of:=[.C9] / [.B9] -> 4.77873 | G9: TROVE | H9: of:=[.E9] -> 4.77873 | I9: of:=[.E17] -> 4.247903 | J9: of:=[.E25] -> 4.2445053 | K9: of:=[.E33] -> 4.5151357 | L9: of:=[.E41] -> 4.715666745
A10: AGRONA | B10: 1000 | C10: 2850.197 | E10: of:=[.C10] / [.B10] -> 2.850197
A11: ECLIPSE | B11: 1000 | C11: 3940.936 | E11: of:=[.C11] / [.B11] -> 3.940936
A12: FASTUTIL | B12: 1000 | C12: 3574.486 | E12: of:=[.C12] / [.B12] -> 3.574486
A13: GDX | B13: 1000 | C13: 2789.153 | E13: of:=[.C13] / [.B13] -> 2.789153
A14: JDK | B14: 1000 | C14: 3759.938 | E14: of:=[.C14] / [.B14] -> 3.759938
A15: KOLOBOKE | B15: 1000 | C15: 2807.607 | E15: of:=[.C15] / [.B15] -> 2.807607
A16: MERRY | B16: 1000 | C16: 3155.029 | E16: of:=[.C16] / [.B16] -> 3.155029
A17: TROVE | B17: 1000 | C17: 4247.903 | E17: of:=[.C17] / [.B17] -> 4.247903
A18: AGRONA | B18: 10000 | C18: 29694.619 | E18: of:=[.C18] / [.B18] -> 2.9694619
A19: ECLIPSE | B19: 10000 | C19: 39374.636 | E19: of:=[.C19] / [.B19] -> 3.9374636
A20: FASTUTIL | B20: 10000 | C20: 35879.47 | E20: of:=[.C20] / [.B20] -> 3.587947
A21: GDX | B21: 10000 | C21: 27658.501 | E21: of:=[.C21] / [.B21] -> 2.7658501
A22: JDK | B22: 10000 | C22: 38596.228 | E22: of:=[.C22] / [.B22] -> 3.8596228
A23: KOLOBOKE | B23: 10000 | C23: 27576.611 | E23: of:=[.C23] / [.B23] -> 2.7576611
A24: MERRY | B24: 10000 | C24: 31526.056 | E24: of:=[.C24] / [.B24] -> 3.1526056
A25: TROVE | B25: 10000 | C25: 42445.053 | E25: of:=[.C25] / [.B25] -> 4.2445053
A26: AGRONA | B26: 100000 | C26: 528706.129 | E26: of:=[.C26] / [.B26] -> 5.28706129
A27: ECLIPSE | B27: 100000 | C27: 403018.145 | E27: of:=[.C27] / [.B27] -> 4.03018145
A28: FASTUTIL | B28: 100000 | C28: 313881.404 | E28: of:=[.C28] / [.B28] -> 3.13881404
A29: GDX | B29: 100000 | C29: 282704.741 | E29: of:=[.C29] / [.B29] -> 2.82704741
A30: JDK | B30: 100000 | C30: 444287.048 | E30: of:=[.C30] / [.B30] -> 4.44287048
A31: KOLOBOKE | B31: 100000 | C31: 511958.087 | E31: of:=[.C31] / [.B31] -> 5.11958087
A32: MERRY | B32: 100000 | C32: 343761.813 | E32: of:=[.C32] / [.B32] -> 3.43761813
A33: TROVE | B33: 100000 | C33: 451513.57 | E33: of:=[.C33] / [.B33] -> 4.5151357
A34: AGRONA | B34: 1000000 | C34: 5960755.159 | E34: of:=[.C34] / [.B34] -> 5.960755159
A35: ECLIPSE | B35: 1000000 | C35: 3686695.872 | E35: of:=[.C35] / [.B35] -> 3.686695872
A36: FASTUTIL | B36: 1000000 | C36: 2745577.311 | E36: of:=[.C36] / [.B36] -> 2.745577311
A37: GDX | B37: 1000000 | C37: 2438373.959 | E37: of:=[.C37] / [.B37] -> 2.438373959
A38: JDK | B38: 1000000 | C38: 4627267.397 | E38: of:=[.C38] / [.B38] -> 4.627267397
A39: KOLOBOKE | B39: 1000000 | C39: 5658474.711 | E39: of:=[.C39] / [.B39] -> 5.658474711
A40: MERRY | B40: 1000000 | C40: 2911223.659 | E40: of:=[.C40] / [.B40] -> 2.911223659
A41: TROVE | B41: 1000000 | C41: 4715666.745 | E41: of:=[.C41] / [.B41] -> 4.715666745

Sheet: REMOVE
A1: Implementation | B1: Iterations | C1: Time per op | E1: Time per iter | H1: 100 | I1: 1K | J1: 10K | K1: 100K | L1: 1M
A2: AGRONA | B2: 100 | C2: 343.817 | E2: of:=[.C2] / [.B2] -> 3.43817 | G2: AGRONA | H2: of:=[.E2] -> 3.43817 | I2: of:=[.E10] -> 2.959028 | J2: of:=[.E18] -> 3.002718 | K2: of:=[.E26] -> 3.2374418 | L2: of:=[.E34] -> 2.348320323
A3: ECLIPSE | B3: 100 | C3: 450.607 | E3: of:=[.C3] / [.B3] -> 4.50607 | G3: ECLIPSE | H3: of:=[.E3] -> 4.50607 | I3: of:=[.E11] -> 3.683575 | J3: of:=[.E19] -> 3.6447432 | K3: of:=[.E27] -> 3.57180912 | L3: of:=[.E35] -> 2.780079874
A4: FASTUTIL | B4: 100 | C4: 296.253 | E4: of:=[.C4] / [.B4] -> 2.96253 | G4: FASTUTIL | H4: of:=[.E4] -> 2.96253 | I4: of:=[.E12] -> 2.999149 | J4: of:=[.E20] -> 2.9895272 | K4: of:=[.E28] -> 3.46711171 | L4: of:=[.E36] -> 2.345160144
A5: GDX | B5: 100 | C5: 632.956 | E5: of:=[.C5] / [.B5] -> 6.32956 | G5: GDX | H5: of:=[.E5] -> 6.32956 | I5: of:=[.E13] -> 5.546678 | J5: of:=[.E21] -> 5.4777402 | K5: of:=[.E29] -> 5.48766265 | L5: of:=[.E37] -> 5.507742159
A6: JDK | B6: 100 | C6: 299.206 | E6: of:=[.C6] / [.B6] -> 2.99206 | G6: JDK | H6: of:=[.E6] -> 2.99206 | I6: of:=[.E14] -> 3.005402 | J6: of:=[.E22] -> 2.9687619 | K6: of:=[.E30] -> 3.54380221 | L6: of:=[.E38] -> 2.587884715
A7: KOLOBOKE | B7: 100 | C7: 432.36 | E7: of:=[.C7] / [.B7] -> 4.3236 | G7: KOLOBOKE | H7: of:=[.E7] -> 4.3236 | I7: of:=[.E15] -> 2.53583 | J7: of:=[.E23] -> 2.4794078 | K7: of:=[.E31] -> 3.64168642 | L7: of:=[.E39] -> 3.568990908
A8: MERRY | B8: 100 | C8: 303.083 | E8: of:=[.C8] / [.B8] -> 3.03083 | G8: MERRY | H8: of:=[.E8] -> 3.03083 | I8: of:=[.E16] -> 2.779662 | J8: of:=[.E24] -> 2.6946406 | K8: of:=[.E32] -> 2.67801237 | L8: of:=[.E40] -> 2.724704938
A9: TROVE | B9: 100 | C9: 863.575 | E9: of:=[.C9] / [.B9] -> 8.63575 | G9: TROVE | H9: of:=[.E9] -> 8.63575 | I9: of:=[.E17] -> 8.14599 | J9: of:=[.E25] -> 8.1664291 | K9: of:=[.E33] -> 7.99753556 | L9: of:=[.E41] -> 7.927191496
A10: AGRONA | B10: 1000 | C10: 2959.028 | E10: of:=[.C10] / [.B10] -> 2.959028
A11: ECLIPSE | B11: 1000 | C11: 3683.575 | E11: of:=[.C11] / [.B11] -> 3.683575
A12: FASTUTIL | B12: 1000 | C12: 2999.149 | E12: of:=[.C12] / [.B12] -> 2.999149
A13: GDX | B13: 1000 | C13: 5546.678 | E13: of:=[.C13] / [.B13] -> 5.546678
A14: JDK | B14: 1000 | C14: 3005.402 | E14: of:=[.C14] / [.B14] -> 3.005402
A15: KOLOBOKE | B15: 1000 | C15: 2535.83 | E15: of:=[.C15] / [.B15] -> 2.53583
A16: MERRY | B16: 1000 | C16: 2779.662 | E16: of:=[.C16] / [.B16] -> 2.779662
A17: TROVE | B17: 1000 | C17: 8145.99 | E17: of:=[.C17] / [.B17] -> 8.14599
A18: AGRONA | B18: 10000 | C18: 30027.18 | E18: of:=[.C18] / [.B18] -> 3.002718
A19: ECLIPSE | B19: 10000 | C19: 36447.432 | E19: of:=[.C19] / [.B19] -> 3.6447432
A20: FASTUTIL | B20: 10000 | C20: 29895.272 | E20: of:=[.C20] / [.B20] -> 2.9895272
A21: GDX | B21: 10000 | C21: 54777.402 | E21: of:=[.C21] / [.B21] -> 5.4777402
A22: JDK | B22: 10000 | C22: 29687.619 | E22: of:=[.C22] / [.B22] -> 2.9687619
A23: KOLOBOKE | B23: 10000 | C23: 24794.078 | E23: of:=[.C23] / [.B23] -> 2.4794078
A24: MERRY | B24: 10000 | C24: 26946.406 | E24: of:=[.C24] / [.B24] -> 2.6946406
A25: TROVE | B25: 10000 | C25: 81664.291 | E25: of:=[.C25] / [.B25] -> 8.1664291
A26: AGRONA | B26: 100000 | C26: 323744.18 | E26: of:=[.C26] / [.B26] -> 3.2374418
A27: ECLIPSE | B27: 100000 | C27: 357180.912 | E27: of:=[.C27] / [.B27] -> 3.57180912
A28: FASTUTIL | B28: 100000 | C28: 346711.171 | E28: of:=[.C28] / [.B28] -> 3.46711171
A29: GDX | B29: 100000 | C29: 548766.265 | E29: of:=[.C29] / [.B29] -> 5.48766265
A30: JDK | B30: 100000 | C30: 354380.221 | E30: of:=[.C30] / [.B30] -> 3.54380221
A31: KOLOBOKE | B31: 100000 | C31: 364168.642 | E31: of:=[.C31] / [.B31] -> 3.64168642
A32: MERRY | B32: 100000 | C32: 267801.237 | E32: of:=[.C32] / [.B32] -> 2.67801237
A33: TROVE | B33: 100000 | C33: 799753.556 | E33: of:=[.C33] / [.B33] -> 7.99753556
A34: AGRONA | B34: 1000000 | C34: 2348320.323 | E34: of:=[.C34] / [.B34] -> 2.348320323
A35: ECLIPSE | B35: 1000000 | C35: 2780079.874 | E35: of:=[.C35] / [.B35] -> 2.780079874
A36: FASTUTIL | B36: 1000000 | C36: 2345160.144 | E36: of:=[.C36] / [.B36] -> 2.345160144
A37: GDX | B37: 1000000 | C37: 5507742.159 | E37: of:=[.C37] / [.B37] -> 5.507742159
A38: JDK | B38: 1000000 | C38: 2587884.715 | E38: of:=[.C38] / [.B38] -> 2.587884715
A39: KOLOBOKE | B39: 1000000 | C39: 3568990.908 | E39: of:=[.C39] / [.B39] -> 3.568990908
A40: MERRY | B40: 1000000 | C40: 2724704.938 | E40: of:=[.C40] / [.B40] -> 2.724704938
A41: TROVE | B41: 1000000 | C41: 7927191.496 | E41: of:=[.C41] / [.B41] -> 7.927191496

Sheet: REMOVE_THEN_ADD
A1: Implementation | B1: Iterations | C1: Time per op | E1: Time per iter | H1: 100 | I1: 1K | J1: 10K | K1: 100K | L1: 1M
A2: AGRONA | B2: 100 | C2: 669.294 | E2: of:=[.C2] / [.B2] -> 6.69294 | G2: AGRONA | H2: of:=[.E2] -> 6.69294 | I2: of:=[.E10] -> 4.841178 | J2: of:=[.E18] -> 5.1901004 | K2: of:=[.E26] -> 8.36289533 | L2: of:=[.E34] -> 8.504466616
A3: ECLIPSE | B3: 100 | C3: 818.648 | E3: of:=[.C3] / [.B3] -> 8.18648 | G3: ECLIPSE | H3: of:=[.E3] -> 8.18648 | I3: of:=[.E11] -> 7.396389 | J3: of:=[.E19] -> 7.0862649 | K3: of:=[.E27] -> 7.35093552 | L3: of:=[.E35] -> 7.313341228
A4: FASTUTIL | B4: 100 | C4: 712.412 | E4: of:=[.C4] / [.B4] -> 7.12412 | G4: FASTUTIL | H4: of:=[.E4] -> 7.12412 | I4: of:=[.E12] -> 5.237127 | J4: of:=[.E20] -> 6.2648841 | K4: of:=[.E28] -> 6.2972125 | L4: of:=[.E36] -> 6.374807258
A5: GDX | B5: 100 | C5: 1146.117 | E5: of:=[.C5] / [.B5] -> 11.46117 | G5: GDX | H5: of:=[.E5] -> 11.46117 | I5: of:=[.E13] -> 10.847504 | J5: of:=[.E21] -> 10.2042106 | K5: of:=[.E29] -> 10.89487493 | L5: of:=[.E37] -> 11.175971022
A6: JDK | B6: 100 | C6: 960.145 | E6: of:=[.C6] / [.B6] -> 9.60145 | G6: JDK | H6: of:=[.E6] -> 9.60145 | I6: of:=[.E14] -> 9.105937 | J6: of:=[.E22] -> 9.8361114 | K6: of:=[.E30] -> 10.12678452 | L6: of:=[.E38] -> 10.288602126
A7: KOLOBOKE | B7: 100 | C7: 715.654 | E7: of:=[.C7] / [.B7] -> 7.15654 | G7: KOLOBOKE | H7: of:=[.E7] -> 7.15654 | I7: of:=[.E15] -> 6.140032 | J7: of:=[.E23] -> 6.3708168 | K7: of:=[.E31] -> 9.55233478 | L7: of:=[.E39] -> 9.567527822
A8: MERRY | B8: 100 | C8: 726.745 | E8: of:=[.C8] / [.B8] -> 7.26745 | G8: MERRY | H8: of:=[.E8] -> 7.26745 | I8: of:=[.E16] -> 6.822807 | J8: of:=[.E24] -> 6.0437444 | K8: of:=[.E32] -> 6.11753995 | L8: of:=[.E40] -> 5.863720221
A9: TROVE | B9: 100 | C9: 1112.845 | E9: of:=[.C9] / [.B9] -> 11.12845 | G9: TROVE | H9: of:=[.E9] -> 11.12845 | I9: of:=[.E17] -> 8.868851 | J9: of:=[.E25] -> 9.1794655 | K9: of:=[.E33] -> 8.15132942 | L9: of:=[.E41] -> 8.359076739
A10: AGRONA | B10: 1000 | C10: 4841.178 | E10: of:=[.C10] / [.B10] -> 4.841178
A11: ECLIPSE | B11: 1000 | C11: 7396.389 | E11: of:=[.C11] / [.B11] -> 7.396389
A12: FASTUTIL | B12: 1000 | C12: 5237.127 | E12: of:=[.C12] / [.B12] -> 5.237127
A13: GDX | B13: 1000 | C13: 10847.504 | E13: of:=[.C13] / [.B13] -> 10.847504
A14: JDK | B14: 1000 | C14: 9105.937 | E14: of:=[.C14] / [.B14] -> 9.105937
A15: KOLOBOKE | B15: 1000 | C15: 6140.032 | E15: of:=[.C15] / [.B15] -> 6.140032
A16: MERRY | B16: 1000 | C16: 6822.807 | E16: of:=[.C16] / [.B16] -> 6.822807
A17: TROVE | B17: 1000 | C17: 8868.851 | E17: of:=[.C17] / [.B17] -> 8.868851
A18: AGRONA | B18: 10000 | C18: 51901.004 | E18: of:=[.C18] / [.B18] -> 5.1901004
A19: ECLIPSE | B19: 10000 | C19: 70862.649 | E19: of:=[.C19] / [.B19] -> 7.0862649
A20: FASTUTIL | B20: 10000 | C20: 62648.841 | E20: of:=[.C20] / [.B20] -> 6.2648841
A21: GDX | B21: 10000 | C21: 102042.106 | E21: of:=[.C21] / [.B21] -> 10.2042106
A22: JDK | B22: 10000 | C22: 98361.114 | E22: of:=[.C22] / [.B22] -> 9.8361114
A23: KOLOBOKE | B23: 10000 | C23: 63708.168 | E23: of:=[.C23] / [.B23] -> 6.3708168
A24: MERRY | B24: 10000 | C24: 60437.444 | E24: of:=[.C24] / [.B24] -> 6.0437444
A25: TROVE | B25: 10000 | C25: 91794.655 | E25: of:=[.C25] / [.B25] -> 9.1794655
A26: AGRONA | B26: 100000 | C26: 836289.533 | E26: of:=[.C26] / [.B26] -> 8.36289533
A27: ECLIPSE | B27: 100000 | C27: 735093.552 | E27: of:=[.C27] / [.B27] -> 7.35093552
A28: FASTUTIL | B28: 100000 | C28: 629721.25 | E28: of:=[.C28] / [.B28] -> 6.2972125
A29: GDX | B29: 100000 | C29: 1089487.493 | E29: of:=[.C29] / [.B29] -> 10.89487493
A30: JDK | B30: 100000 | C30: 1012678.452 | E30: of:=[.C30] / [.B30] -> 10.12678452
A31: KOLOBOKE | B31: 100000 | C31: 955233.478 | E31: of:=[.C31] / [.B31] -> 9.55233478
A32: MERRY | B32: 100000 | C32: 611753.995 | E32: of:=[.C32] / [.B32] -> 6.11753995
A33: TROVE | B33: 100000 | C33: 815132.942 | E33: of:=[.C33] / [.B33] -> 8.15132942
A34: AGRONA | B34: 1000000 | C34: 8504466.616 | E34: of:=[.C34] / [.B34] -> 8.504466616
A35: ECLIPSE | B35: 1000000 | C35: 7313341.228 | E35: of:=[.C35] / [.B35] -> 7.313341228
A36: FASTUTIL | B36: 1000000 | C36: 6374807.258 | E36: of:=[.C36] / [.B36] -> 6.374807258
A37: GDX | B37: 1000000 | C37: 11175971.022 | E37: of:=[.C37] / [.B37] -> 11.175971022
A38: JDK | B38: 1000000 | C38: 10288602.126 | E38: of:=[.C38] / [.B38] -> 10.288602126
A39: KOLOBOKE | B39: 1000000 | C39: 9567527.822 | E39: of:=[.C39] / [.B39] -> 9.567527822
A40: MERRY | B40: 1000000 | C40: 5863720.221 | E40: of:=[.C40] / [.B40] -> 5.863720221
A41: TROVE | B41: 1000000 | C41: 8359076.739 | E41: of:=[.C41] / [.B41] -> 8.359076739

Sheet: Sheet7
A1: AGRONA | B1: 100 | C1: 398.636 | D1: ADD
A2: ECLIPSE | B2: 100 | C2: 498.09 | D2: ADD
A3: FASTUTIL | B3: 100 | C3: 423.881 | D3: ADD
A4: GDX | B4: 100 | C4: 310.083 | D4: ADD
A5: JDK | B5: 100 | C5: 663.871 | D5: ADD
A6: KOLOBOKE | B6: 100 | C6: 477.092 | D6: ADD
A7: MERRY | B7: 100 | C7: 370.311 | D7: ADD
A8: TROVE | B8: 100 | C8: 506.299 | D8: ADD
A9: AGRONA | B9: 1000 | C9: 3395.867 | D9: ADD
A10: ECLIPSE | B10: 1000 | C10: 4594.253 | D10: ADD
A11: FASTUTIL | B11: 1000 | C11: 3675.48 | D11: ADD
A12: GDX | B12: 1000 | C12: 2554.719 | D12: ADD
A13: JDK | B13: 1000 | C13: 5642.367 | D13: ADD
A14: KOLOBOKE | B14: 1000 | C14: 4381.381 | D14: ADD
A15: MERRY | B15: 1000 | C15: 3282.242 | D15: ADD
A16: TROVE | B16: 1000 | C16: 4649.973 | D16: ADD
A17: AGRONA | B17: 10000 | C17: 34018.067 | D17: ADD
A18: ECLIPSE | B18: 10000 | C18: 46411.412 | D18: ADD
A19: FASTUTIL | B19: 10000 | C19: 36970.854 | D19: ADD
A20: GDX | B20: 10000 | C20: 24650.698 | D20: ADD
A21: JDK | B21: 10000 | C21: 67238.449 | D21: ADD
A22: KOLOBOKE | B22: 10000 | C22: 42586.368 | D22: ADD
A23: MERRY | B23: 10000 | C23: 32591.665 | D23: ADD
A24: TROVE | B24: 10000 | C24: 49280.691 | D24: ADD
A25: AGRONA | B25: 100000 | C25: 621342.519 | D25: ADD
A26: ECLIPSE | B26: 100000 | C26: 464952.397 | D26: ADD
A27: FASTUTIL | B27: 100000 | C27: 388045.401 | D27: ADD
A28: GDX | B28: 100000 | C28: 247642.536 | D28: ADD
A29: JDK | B29: 100000 | C29: 727504.19 | D29: ADD
A30: KOLOBOKE | B30: 100000 | C30: 497686.582 | D30: ADD
A31: MERRY | B31: 100000 | C31: 348727.12 | D31: ADD
A32: TROVE | B32: 100000 | C32: 534628.521 | D32: ADD
A33: AGRONA | B33: 1000000 | C33: 5884157.592 | D33: ADD
A34: ECLIPSE | B34: 1000000 | C34: 4108055.095 | D34: ADD
A35: FASTUTIL | B35: 1000000 | C35: 2906035.473 | D35: ADD
A36: GDX | B36: 1000000 | C36: 2497118.442 | D36: ADD
A37: JDK | B37: 1000000 | C37: 6905521.095 | D37: ADD
A38: KOLOBOKE | B38: 1000000 | C38: 5619940.236 | D38: ADD
A39: MERRY | B39: 1000000 | C39: 3390907.348 | D39: ADD
A40: TROVE | B40: 1000000 | C40: 4137587.854 | D40: ADD
A41: AGRONA | B41: 100 | C41: 401.083 | D41: ADD_OR_REMOVE
A42: ECLIPSE | B42: 100 | C42: 430.779 | D42: ADD_OR_REMOVE
A43: FASTUTIL | B43: 100 | C43: 444.852 | D43: ADD_OR_REMOVE
A44: GDX | B44: 100 | C44: 631.485 | D44: ADD_OR_REMOVE
A45: JDK | B45: 100 | C45: 802.08 | D45: ADD_OR_REMOVE
A46: KOLOBOKE | B46: 100 | C46: 442.857 | D46: ADD_OR_REMOVE
A47: MERRY | B47: 100 | C47: 483.022 | D47: ADD_OR_REMOVE
A48: TROVE | B48: 100 | C48: 2284.125 | D48: ADD_OR_REMOVE
A49: AGRONA | B49: 1000 | C49: 3064.452 | D49: ADD_OR_REMOVE
A50: ECLIPSE | B50: 1000 | C50: 3717.619 | D50: ADD_OR_REMOVE
A51: FASTUTIL | B51: 1000 | C51: 3442.378 | D51: ADD_OR_REMOVE
A52: GDX | B52: 1000 | C52: 5814.075 | D52: ADD_OR_REMOVE
A53: JDK | B53: 1000 | C53: 6384.868 | D53: ADD_OR_REMOVE
A54: KOLOBOKE | B54: 1000 | C54: 3581.12 | D54: ADD_OR_REMOVE
A55: MERRY | B55: 1000 | C55: 3647.465 | D55: ADD_OR_REMOVE
A56: TROVE | B56: 1000 | C56: 20223.476 | D56: ADD_OR_REMOVE
A57: AGRONA | B57: 10000 | C57: 30423.464 | D57: ADD_OR_REMOVE
A58: ECLIPSE | B58: 10000 | C58: 35800.055 | D58: ADD_OR_REMOVE
A59: FASTUTIL | B59: 10000 | C59: 33825.775 | D59: ADD_OR_REMOVE
A60: GDX | B60: 10000 | C60: 58720.583 | D60: ADD_OR_REMOVE
A61: JDK | B61: 10000 | C61: 60970.033 | D61: ADD_OR_REMOVE
A62: KOLOBOKE | B62: 10000 | C62: 35487.642 | D62: ADD_OR_REMOVE
A63: MERRY | B63: 10000 | C63: 37642.181 | D63: ADD_OR_REMOVE
A64: TROVE | B64: 10000 | C64: 212970.184 | D64: ADD_OR_REMOVE
A65: AGRONA | B65: 100000 | C65: 304019.037 | D65: ADD_OR_REMOVE
A66: ECLIPSE | B66: 100000 | C66: 354831.784 | D66: ADD_OR_REMOVE
A67: FASTUTIL | B67: 100000 | C67: 336231.029 | D67: ADD_OR_REMOVE
A68: GDX | B68: 100000 | C68: 591804.66 | D68: ADD_OR_REMOVE
A69: JDK | B69: 100000 | C69: 618345.992 | D69: ADD_OR_REMOVE
A70: KOLOBOKE | B70: 100000 | C70: 355097.099 | D70: ADD_OR_REMOVE
A71: MERRY | B71: 100000 | C71: 375379.585 | D71: ADD_OR_REMOVE
A72: TROVE | B72: 100000 | C72: 2132254.147 | D72: ADD_OR_REMOVE
A73: AGRONA | B73: 1000000 | C73: 3051874.762 | D73: ADD_OR_REMOVE
A74: ECLIPSE | B74: 1000000 | C74: 3585222.3 | D74: ADD_OR_REMOVE
A75: FASTUTIL | B75: 1000000 | C75: 3362331.798 | D75: ADD_OR_REMOVE
A76: GDX | B76: 1000000 | C76: 5267131.763 | D76: ADD_OR_REMOVE
A77: JDK | B77: 1000000 | C77: 6243186.634 | D77: ADD_OR_REMOVE
A78: KOLOBOKE | B78: 1000000 | C78: 3557341.551 | D78: ADD_OR_REMOVE
A79: MERRY | B79: 1000000 | C79: 3728506.758 | D79: ADD_OR_REMOVE
A80: TROVE | B80: 1000000 | C80: 21390090.53 | D80: ADD_OR_REMOVE
A81: AGRONA | B81: 100 | C81: 673.805 | D81: ADD_THEN_REMOVE
A82: ECLIPSE | B82: 100 | C82: 805.182 | D82: ADD_THEN_REMOVE
A83: FASTUTIL | B83: 100 | C83: 720.704 | D83: ADD_THEN_REMOVE
A84: GDX | B84: 100 | C84: 998.687 | D84: ADD_THEN_REMOVE
A85: JDK | B85: 100 | C85: 1021.551 | D85: ADD_THEN_REMOVE
A86: KOLOBOKE | B86: 100 | C86: 636.266 | D86: ADD_THEN_REMOVE
A87: MERRY | B87: 100 | C87: 729.723 | D87: ADD_THEN_REMOVE
A88: TROVE | B88: 100 | C88: 1026.299 | D88: ADD_THEN_REMOVE
A89: AGRONA | B89: 1000 | C89: 5744.003 | D89: ADD_THEN_REMOVE
A90: ECLIPSE | B90: 1000 | C90: 7041.425 | D90: ADD_THEN_REMOVE
A91: FASTUTIL | B91: 1000 | C91: 5191.565 | D91: ADD_THEN_REMOVE
A92: GDX | B92: 1000 | C92: 9586.415 | D92: ADD_THEN_REMOVE
A93: JDK | B93: 1000 | C93: 9286.802 | D93: ADD_THEN_REMOVE
A94: KOLOBOKE | B94: 1000 | C94: 5421.231 | D94: ADD_THEN_REMOVE
A95: MERRY | B95: 1000 | C95: 6549.749 | D95: ADD_THEN_REMOVE
A96: TROVE | B96: 1000 | C96: 9289.5 | D96: ADD_THEN_REMOVE
A97: AGRONA | B97: 10000 | C97: 50728.286 | D97: ADD_THEN_REMOVE
A98: ECLIPSE | B98: 10000 | C98: 62581.008 | D98: ADD_THEN_REMOVE
A99: FASTUTIL | B99: 10000 | C99: 52616.98 | D99: ADD_THEN_REMOVE
A100: GDX | B100: 10000 | C100: 92695.965 | D100: ADD_THEN_REMOVE
A101: JDK | B101: 10000 | C101: 96696.318 | D101: ADD_THEN_REMOVE
A102: KOLOBOKE | B102: 10000 | C102: 61553.872 | D102: ADD_THEN_REMOVE
A103: MERRY | B103: 10000 | C103: 58281.875 | D103: ADD_THEN_REMOVE
A104: TROVE | B104: 10000 | C104: 85607.981 | D104: ADD_THEN_REMOVE
A105: AGRONA | B105: 100000 | C105: 850006.327 | D105: ADD_THEN_REMOVE
A106: ECLIPSE | B106: 100000 | C106: 700932.547 | D106: ADD_THEN_REMOVE
A107: FASTUTIL | B107: 100000 | C107: 520517.413 | D107: ADD_THEN_REMOVE
A108: GDX | B108: 100000 | C108: 959397.299 | D108: ADD_THEN_REMOVE
A109: JDK | B109: 100000 | C109: 1022193.163 | D109: ADD_THEN_REMOVE
A110: KOLOBOKE | B110: 100000 | C110: 933022.256 | D110: ADD_THEN_REMOVE
A111: MERRY | B111: 100000 | C111: 585299.654 | D111: ADD_THEN_REMOVE
A112: TROVE | B112: 100000 | C112: 833870.786 | D112: ADD_THEN_REMOVE
A113: AGRONA | B113: 1000000 | C113: 8266291.649 | D113: ADD_THEN_REMOVE
A114: ECLIPSE | B114: 1000000 | C114: 7001536.655 | D114: ADD_THEN_REMOVE
A115: FASTUTIL | B115: 1000000 | C115: 5363782.923 | D115: ADD_THEN_REMOVE
A116: GDX | B116: 1000000 | C116: 10467981.254 | D116: ADD_THEN_REMOVE
A117: JDK | B117: 1000000 | C117: 10291225.146 | D117: ADD_THEN_REMOVE
A118: KOLOBOKE | B118: 1000000 | C118: 9285972.283 | D118: ADD_THEN_REMOVE
A119: MERRY | B119: 1000000 | C119: 5833382.035 | D119: ADD_THEN_REMOVE
A120: TROVE | B120: 1000000 | C120: 8234117.809 | D120: ADD_THEN_REMOVE
A121: AGRONA | B121: 100 | C121: 353.749 | D121: CONTAINS
A122: ECLIPSE | B122: 100 | C122: 463.114 | D122: CONTAINS
A123: FASTUTIL | B123: 100 | C123: 407.514 | D123: CONTAINS
A124: GDX | B124: 100 | C124: 331.211 | D124: CONTAINS
A125: JDK | B125: 100 | C125: 418.356 | D125: CONTAINS
A126: KOLOBOKE | B126: 100 | C126: 335.064 | D126: CONTAINS
A127: MERRY | B127: 100 | C127: 371.142 | D127: CONTAINS
A128: TROVE | B128: 100 | C128: 477.873 | D128: CONTAINS
A129: AGRONA | B129: 1000 | C129: 2850.197 | D129: CONTAINS
A130: ECLIPSE | B130: 1000 | C130: 3940.936 | D130: CONTAINS
A131: FASTUTIL | B131: 1000 | C131: 3574.486 | D131: CONTAINS
A132: GDX | B132: 1000 | C132: 2789.153 | D132: CONTAINS
A133: JDK | B133: 1000 | C133: 3759.938 | D133: CONTAINS
A134: KOLOBOKE | B134: 1000 | C134: 2807.607 | D134: CONTAINS
A135: MERRY | B135: 1000 | C135: 3155.029 | D135: CONTAINS
A136: TROVE | B136: 1000 | C136: 4247.903 | D136: CONTAINS
A137: AGRONA | B137: 10000 | C137: 29694.619 | D137: CONTAINS
A138: ECLIPSE | B138: 10000 | C138: 39374.636 | D138: CONTAINS
A139: FASTUTIL | B139: 10000 | C139: 35879.47 | D139: CONTAINS
A140: GDX | B140: 10000 | C140: 27658.501 | D140: CONTAINS
A141: JDK | B141: 10000 | C141: 38596.228 | D141: CONTAINS
A142: KOLOBOKE | B142: 10000 | C142: 27576.611 | D142: CONTAINS
A143: MERRY | B143: 10000 | C143: 31526.056 | D143: CONTAINS
A144: TROVE | B144: 10000 | C144: 42445.053 | D144: CONTAINS
A145: AGRONA | B145: 100000 | C145: 528706.129 | D145: CONTAINS
A146: ECLIPSE | B146: 100000 | C146: 403018.145 | D146: CONTAINS
A147: FASTUTIL | B147: 100000 | C147: 313881.404 | D147: CONTAINS
A148: GDX | B148: 100000 | C148: 282704.741 | D148: CONTAINS
A149: JDK | B149: 100000 | C149: 444287.048 | D149: CONTAINS
A150: KOLOBOKE | B150: 100000 | C150: 511958.087 | D150: CONTAINS
A151: MERRY | B151: 100000 | C151: 343761.813 | D151: CONTAINS
A152: TROVE | B152: 100000 | C152: 451513.57 | D152: CONTAINS
A153: AGRONA | B153: 1000000 | C153: 5960755.159 | D153: CONTAINS
A154: ECLIPSE | B154: 1000000 | C154: 3686695.872 | D154: CONTAINS
A155: FASTUTIL | B155: 1000000 | C155: 2745577.311 | D155: CONTAINS
A156: GDX | B156: 1000000 | C156: 2438373.959 | D156: CONTAINS
A157: JDK | B157: 1000000 | C157: 4627267.397 | D157: CONTAINS
A158: KOLOBOKE | B158: 1000000 | C158: 5658474.711 | D158: CONTAINS
A159: MERRY | B159: 1000000 | C159: 2911223.659 | D159: CONTAINS
A160: TROVE | B160: 1000000 | C160: 4715666.745 | D160: CONTAINS
A161: AGRONA | B161: 100 | C161: 343.817 | D161: REMOVE
A162: ECLIPSE | B162: 100 | C162: 450.607 | D162: REMOVE
A163: FASTUTIL | B163: 100 | C163: 296.253 | D163: REMOVE
A164: GDX | B164: 100 | C164: 632.956 | D164: REMOVE
A165: JDK | B165: 100 | C165: 299.206 | D165: REMOVE
A166: KOLOBOKE | B166: 100 | C166: 432.36 | D166: REMOVE
A167: MERRY | B167: 100 | C167: 303.083 | D167: REMOVE
A168: TROVE | B168: 100 | C168: 863.575 | D168: REMOVE
A169: AGRONA | B169: 1000 | C169: 2959.028 | D169: REMOVE
A170: ECLIPSE | B170: 1000 | C170: 3683.575 | D170: REMOVE
A171: FASTUTIL | B171: 1000 | C171: 2999.149 | D171: REMOVE
A172: GDX | B172: 1000 | C172: 5546.678 | D172: REMOVE
A173: JDK | B173: 1000 | C173: 3005.402 | D173: REMOVE
A174: KOLOBOKE | B174: 1000 | C174: 2535.83 | D174: REMOVE
A175: MERRY | B175: 1000 | C175: 2779.662 | D175: REMOVE
A176: TROVE | B176: 1000 | C176: 8145.99 | D176: REMOVE
A177: AGRONA | B177: 10000 | C177: 30027.18 | D177: REMOVE
A178: ECLIPSE | B178: 10000 | C178: 36447.432 | D178: REMOVE
A179: FASTUTIL | B179: 10000 | C179: 29895.272 | D179: REMOVE
A180: GDX | B180: 10000 | C180: 54777.402 | D180: REMOVE
A181: JDK | B181: 10000 | C181: 29687.619 | D181: REMOVE
A182: KOLOBOKE | B182: 10000 | C182: 24794.078 | D182: REMOVE
A183: MERRY | B183: 10000 | C183: 26946.406 | D183: REMOVE
A184: TROVE | B184: 10000 | C184: 81664.291 | D184: REMOVE
A185: AGRONA | B185: 100000 | C185: 323744.18 | D185: REMOVE
A186: ECLIPSE | B186: 100000 | C186: 357180.912 | D186: REMOVE
A187: FASTUTIL | B187: 100000 | C187: 346711.171 | D187: REMOVE
A188: GDX | B188: 100000 | C188: 548766.265 | D188: REMOVE
A189: JDK | B189: 100000 | C189: 354380.221 | D189: REMOVE
A190: KOLOBOKE | B190: 100000 | C190: 364168.642 | D190: REMOVE
A191: MERRY | B191: 100000 | C191: 267801.237 | D191: REMOVE
A192: TROVE | B192: 100000 | C192: 799753.556 | D192: REMOVE
A193: AGRONA | B193: 1000000 | C193: 2348320.323 | D193: REMOVE
A194: ECLIPSE | B194: 1000000 | C194: 2780079.874 | D194: REMOVE
A195: FASTUTIL | B195: 1000000 | C195: 2345160.144 | D195: REMOVE
A196: GDX | B196: 1000000 | C196: 5507742.159 | D196: REMOVE
A197: JDK | B197: 1000000 | C197: 2587884.715 | D197: REMOVE
A198: KOLOBOKE | B198: 1000000 | C198: 3568990.908 | D198: REMOVE
A199: MERRY | B199: 1000000 | C199: 2724704.938 | D199: REMOVE
A200: TROVE | B200: 1000000 | C200: 7927191.496 | D200: REMOVE
A201: AGRONA | B201: 100 | C201: 669.294 | D201: REMOVE_THEN_ADD
A202: ECLIPSE | B202: 100 | C202: 818.648 | D202: REMOVE_THEN_ADD
A203: FASTUTIL | B203: 100 | C203: 712.412 | D203: REMOVE_THEN_ADD
A204: GDX | B204: 100 | C204: 1146.117 | D204: REMOVE_THEN_ADD
A205: JDK | B205: 100 | C205: 960.145 | D205: REMOVE_THEN_ADD
A206: KOLOBOKE | B206: 100 | C206: 715.654 | D206: REMOVE_THEN_ADD
A207: MERRY | B207: 100 | C207: 726.745 | D207: REMOVE_THEN_ADD
A208: TROVE | B208: 100 | C208: 1112.845 | D208: REMOVE_THEN_ADD
A209: AGRONA | B209: 1000 | C209: 4841.178 | D209: REMOVE_THEN_ADD
A210: ECLIPSE | B210: 1000 | C210: 7396.389 | D210: REMOVE_THEN_ADD
A211: FASTUTIL | B211: 1000 | C211: 5237.127 | D211: REMOVE_THEN_ADD
A212: GDX | B212: 1000 | C212: 10847.504 | D212: REMOVE_THEN_ADD
A213: JDK | B213: 1000 | C213: 9105.937 | D213: REMOVE_THEN_ADD
A214: KOLOBOKE | B214: 1000 | C214: 6140.032 | D214: REMOVE_THEN_ADD
A215: MERRY | B215: 1000 | C215: 6822.807 | D215: REMOVE_THEN_ADD
A216: TROVE | B216: 1000 | C216: 8868.851 | D216: REMOVE_THEN_ADD
A217: AGRONA | B217: 10000 | C217: 51901.004 | D217: REMOVE_THEN_ADD
A218: ECLIPSE | B218: 10000 | C218: 70862.649 | D218: REMOVE_THEN_ADD
A219: FASTUTIL | B219: 10000 | C219: 62648.841 | D219: REMOVE_THEN_ADD
A220: GDX | B220: 10000 | C220: 102042.106 | D220: REMOVE_THEN_ADD
A221: JDK | B221: 10000 | C221: 98361.114 | D221: REMOVE_THEN_ADD
A222: KOLOBOKE | B222: 10000 | C222: 63708.168 | D222: REMOVE_THEN_ADD
A223: MERRY | B223: 10000 | C223: 60437.444 | D223: REMOVE_THEN_ADD
A224: TROVE | B224: 10000 | C224: 91794.655 | D224: REMOVE_THEN_ADD
A225: AGRONA | B225: 100000 | C225: 836289.533 | D225: REMOVE_THEN_ADD
A226: ECLIPSE | B226: 100000 | C226: 735093.552 | D226: REMOVE_THEN_ADD
A227: FASTUTIL | B227: 100000 | C227: 629721.25 | D227: REMOVE_THEN_ADD
A228: GDX | B228: 100000 | C228: 1089487.493 | D228: REMOVE_THEN_ADD
A229: JDK | B229: 100000 | C229: 1012678.452 | D229: REMOVE_THEN_ADD
A230: KOLOBOKE | B230: 100000 | C230: 955233.478 | D230: REMOVE_THEN_ADD
A231: MERRY | B231: 100000 | C231: 611753.995 | D231: REMOVE_THEN_ADD
A232: TROVE | B232: 100000 | C232: 815132.942 | D232: REMOVE_THEN_ADD
A233: AGRONA | B233: 1000000 | C233: 8504466.616 | D233: REMOVE_THEN_ADD
A234: ECLIPSE | B234: 1000000 | C234: 7313341.228 | D234: REMOVE_THEN_ADD
A235: FASTUTIL | B235: 1000000 | C235: 6374807.258 | D235: REMOVE_THEN_ADD
A236: GDX | B236: 1000000 | C236: 11175971.022 | D236: REMOVE_THEN_ADD
A237: JDK | B237: 1000000 | C237: 10288602.126 | D237: REMOVE_THEN_ADD
A238: KOLOBOKE | B238: 1000000 | C238: 9567527.822 | D238: REMOVE_THEN_ADD
A239: MERRY | B239: 1000000 | C239: 5863720.221 | D239: REMOVE_THEN_ADD
A240: TROVE | B240: 1000000 | C240: 8359076.739 | D240: REMOVE_THEN_ADD