Sheet: ADD
A1: Implementation | B1: Iterations | C1: Time per op | E1: Time per iter | H1: 100 | I1: 1K | J1: 10K | K1: 100K | L1: 1M
A2: APACHE | B2: 100 | C2: 1177.624 | E2: of:=[.C2] / [.B2] -> 11.77624 | G2: APACHE | H2: of:=[.E2] -> 11.77624 | I2: of:=[.E7] -> 11.007263 | J2: of:=[.E12] -> 11.0063122 | K2: of:=[.E17] -> 9.59624603 | L2: of:=[.E22] -> 9.766217392
A3: FASTUTIL | B3: 100 | C3: 434.528 | E3: of:=[.C3] / [.B3] -> 4.34528 | G3: FASTUTIL | H3: of:=[.E3] -> 4.34528 | I3: of:=[.E8] -> 4.264447 | J3: of:=[.E13] -> 4.267011 | K3: of:=[.E18] -> 4.27692553 | L3: of:=[.E23] -> 4.370183559
A4: GDX | B4: 100 | C4: 377.24 | E4: of:=[.C4] / [.B4] -> 3.7724 | G4: GDX | H4: of:=[.E4] -> 3.7724 | I4: of:=[.E9] -> 2.889235 | J4: of:=[.E14] -> 2.834613 | K4: of:=[.E19] -> 2.83161363 | L4: of:=[.E24] -> 5.551540536
A5: JDK | B5: 100 | C5: 723.624 | E5: of:=[.C5] / [.B5] -> 7.23624 | G5: JDK | H5: of:=[.E5] -> 7.23624 | I5: of:=[.E10] -> 6.299871 | J5: of:=[.E15] -> 8.0288279 | K5: of:=[.E20] -> 8.99119476 | L5: of:=[.E25] -> 9.03735432
A6: MERRY | B6: 100 | C6: 445.613 | E6: of:=[.C6] / [.B6] -> 4.45613 | G6: MERRY | H6: of:=[.E6] -> 4.45613 | I6: of:=[.E11] -> 3.785805 | J6: of:=[.E16] -> 3.7937102 | K6: of:=[.E21] -> 3.79045655 | L6: of:=[.E26] -> 3.783858704
A7: APACHE | B7: 1000 | C7: 11007.263 | E7: of:=[.C7] / [.B7] -> 11.007263
A8: FASTUTIL | B8: 1000 | C8: 4264.447 | E8: of:=[.C8] / [.B8] -> 4.264447
A9: GDX | B9: 1000 | C9: 2889.235 | E9: of:=[.C9] / [.B9] -> 2.889235
A10: JDK | B10: 1000 | C10: 6299.871 | E10: of:=[.C10] / [.B10] -> 6.299871
A11: MERRY | B11: 1000 | C11: 3785.805 | E11: of:=[.C11] / [.B11] -> 3.785805
A12: APACHE | B12: 10000 | C12: 110063.122 | E12: of:=[.C12] / [.B12] -> 11.0063122
A13: FASTUTIL | B13: 10000 | C13: 42670.11 | E13: of:=[.C13] / [.B13] -> 4.267011
A14: GDX | B14: 10000 | C14: 28346.13 | E14: of:=[.C14] / [.B14] -> 2.834613
A15: JDK | B15: 10000 | C15: 80288.279 | E15: of:=[.C15] / [.B15] -> 8.0288279
A16: MERRY | B16: 10000 | C16: 37937.102 | E16: of:=[.C16] / [.B16] -> 3.7937102
A17: APACHE | B17: 100000 | C17: 959624.603 | E17: of:=[.C17] / [.B17] -> 9.59624603
A18: FASTUTIL | B18: 100000 | C18: 427692.553 | E18: of:=[.C18] / [.B18] -> 4.27692553
A19: GDX | B19: 100000 | C19: 283161.363 | E19: of:=[.C19] / [.B19] -> 2.83161363
A20: JDK | B20: 100000 | C20: 899119.476 | E20: of:=[.C20] / [.B20] -> 8.99119476
A21: MERRY | B21: 100000 | C21: 379045.655 | E21: of:=[.C21] / [.B21] -> 3.79045655
A22: APACHE | B22: 1000000 | C22: 9766217.392 | E22: of:=[.C22] / [.B22] -> 9.766217392
A23: FASTUTIL | B23: 1000000 | C23: 4370183.559 | E23: of:=[.C23] / [.B23] -> 4.370183559
A24: GDX | B24: 1000000 | C24: 5551540.536 | E24: of:=[.C24] / [.B24] -> 5.551540536
A25: JDK | B25: 1000000 | C25: 9037354.32 | E25: of:=[.C25] / [.B25] -> 9.03735432
A26: MERRY | B26: 1000000 | C26: 3783858.704 | E26: of:=[.C26] / [.B26] -> 3.783858704

Sheet: ADD_OR_REMOVE
A1: Implementation | B1: Iterations | C1: Time per op | E1: Time per iter | H1: 100 | I1: 1K | J1: 10K | K1: 100K | L1: 1M
A2: APACHE | B2: 100 | C2: 1270.078 | E2: of:=[.C2] / [.B2] -> 12.70078 | G2: APACHE | H2: of:=[.E2] -> 12.70078 | I2: of:=[.E7] -> 12.572251 | J2: of:=[.E12] -> 11.9350653 | K2: of:=[.E17] -> 10.68447954 | L2: of:=[.E22] -> 10.666841134
A3: FASTUTIL | B3: 100 | C3: 574.464 | E3: of:=[.C3] / [.B3] -> 5.74464 | G3: FASTUTIL | H3: of:=[.E3] -> 5.74464 | I3: of:=[.E8] -> 4.837264 | J3: of:=[.E13] -> 4.8894288 | K3: of:=[.E18] -> 4.91061993 | L3: of:=[.E23] -> 4.881426292
A4: GDX | B4: 100 | C4: 989.49 | E4: of:=[.C4] / [.B4] -> 9.8949 | G4: GDX | H4: of:=[.E4] -> 9.8949 | I4: of:=[.E9] -> 9.433485 | J4: of:=[.E14] -> 9.9132867 | K4: of:=[.E19] -> 9.26482571 | L4: of:=[.E24] -> 9.183054619
A5: JDK | B5: 100 | C5: 1093.977 | E5: of:=[.C5] / [.B5] -> 10.93977 | G5: JDK | H5: of:=[.E5] -> 10.93977 | I5: of:=[.E10] -> 11.121696 | J5: of:=[.E15] -> 11.4451924 | K5: of:=[.E20] -> 10.1325905 | L5: of:=[.E25] -> 10.726491767
A6: MERRY | B6: 100 | C6: 843.057 | E6: of:=[.C6] / [.B6] -> 8.43057 | G6: MERRY | H6: of:=[.E6] -> 8.43057 | I6: of:=[.E11] -> 7.762848 | J6: of:=[.E16] -> 8.3146546 | K6: of:=[.E21] -> 8.32547099 | L6: of:=[.E26] -> 7.714578056
A7: APACHE | B7: 1000 | C7: 12572.251 | E7: of:=[.C7] / [.B7] -> 12.572251
A8: FASTUTIL | B8: 1000 | C8: 4837.264 | E8: of:=[.C8] / [.B8] -> 4.837264
A9: GDX | B9: 1000 | C9: 9433.485 | E9: of:=[.C9] / [.B9] -> 9.433485
A10: JDK | B10: 1000 | C10: 11121.696 | E10: of:=[.C10] / [.B10] -> 11.121696
A11: MERRY | B11: 1000 | C11: 7762.848 | E11: of:=[.C11] / [.B11] -> 7.762848
A12: APACHE | B12: 10000 | C12: 119350.653 | E12: of:=[.C12] / [.B12] -> 11.9350653
A13: FASTUTIL | B13: 10000 | C13: 48894.288 | E13: of:=[.C13] / [.B13] -> 4.8894288
A14: GDX | B14: 10000 | C14: 99132.867 | E14: of:=[.C14] / [.B14] -> 9.9132867
A15: JDK | B15: 10000 | C15: 114451.924 | E15: of:=[.C15] / [.B15] -> 11.4451924
A16: MERRY | B16: 10000 | C16: 83146.546 | E16: of:=[.C16] / [.B16] -> 8.3146546
A17: APACHE | B17: 100000 | C17: 1068447.954 | E17: of:=[.C17] / [.B17] -> 10.68447954
A18: FASTUTIL | B18: 100000 | C18: 491061.993 | E18: of:=[.C18] / [.B18] -> 4.91061993
A19: GDX | B19: 100000 | C19: 926482.571 | E19: of:=[.C19] / [.B19] -> 9.26482571
A20: JDK | B20: 100000 | C20: 1013259.05 | E20: of:=[.C20] / [.B20] -> 10.1325905
A21: MERRY | B21: 100000 | C21: 832547.099 | E21: of:=[.C21] / [.B21] -> 8.32547099
A22: APACHE | B22: 1000000 | C22: 10666841.134 | E22: of:=[.C22] / [.B22] -> 10.666841134
A23: FASTUTIL | B23: 1000000 | C23: 4881426.292 | E23: of:=[.C23] / [.B23] -> 4.881426292
A24: GDX | B24: 1000000 | C24: 9183054.619 | E24: of:=[.C24] / [.B24] -> 9.183054619
A25: JDK | B25: 1000000 | C25: 10726491.767 | E25: of:=[.C25] / [.B25] -> 10.726491767
A26: MERRY | B26: 1000000 | C26: 7714578.056 | E26: of:=[.C26] / [.B26] -> 7.714578056

Sheet: ADD_THEN_REMOVE
A1: Implementation | B1: Iterations | C1: Time per op | E1: Time per iter | H1: 100 | I1: 1K | J1: 10K | K1: 100K | L1: 1M
A2: APACHE | B2: 100 | C2: 1510.37 | E2: of:=[.C2] / [.B2] -> 15.1037 | G2: APACHE | H2: of:=[.E2] -> 15.1037 | I2: of:=[.E7] -> 12.415744 | J2: of:=[.E12] -> 15.698891 | K2: of:=[.E17] -> 14.28713337 | L2: of:=[.E22] -> 14.311544186
A3: FASTUTIL | B3: 100 | C3: 792.866 | E3: of:=[.C3] / [.B3] -> 7.92866 | G3: FASTUTIL | H3: of:=[.E3] -> 7.92866 | I3: of:=[.E8] -> 6.902072 | J3: of:=[.E13] -> 6.870941 | K3: of:=[.E18] -> 6.87126688 | L3: of:=[.E23] -> 6.910462707
A4: GDX | B4: 100 | C4: 1215.016 | E4: of:=[.C4] / [.B4] -> 12.15016 | G4: GDX | H4: of:=[.E4] -> 12.15016 | I4: of:=[.E9] -> 11.463256 | J4: of:=[.E14] -> 13.243485 | K4: of:=[.E19] -> 13.08415285 | L4: of:=[.E24] -> 14.62606424
A5: JDK | B5: 100 | C5: 1478.631 | E5: of:=[.C5] / [.B5] -> 14.78631 | G5: JDK | H5: of:=[.E5] -> 14.78631 | I5: of:=[.E10] -> 13.202641 | J5: of:=[.E15] -> 12.7795372 | K5: of:=[.E20] -> 11.96771408 | L5: of:=[.E25] -> 12.158165402
A6: MERRY | B6: 100 | C6: 879.191 | E6: of:=[.C6] / [.B6] -> 8.79191 | G6: MERRY | H6: of:=[.E6] -> 8.79191 | I6: of:=[.E11] -> 8.716636 | J6: of:=[.E16] -> 9.3247453 | K6: of:=[.E21] -> 8.67799608 | L6: of:=[.E26] -> 7.724004665
A7: APACHE | B7: 1000 | C7: 12415.744 | E7: of:=[.C7] / [.B7] -> 12.415744
A8: FASTUTIL | B8: 1000 | C8: 6902.072 | E8: of:=[.C8] / [.B8] -> 6.902072
A9: GDX | B9: 1000 | C9: 11463.256 | E9: of:=[.C9] / [.B9] -> 11.463256
A10: JDK | B10: 1000 | C10: 13202.641 | E10: of:=[.C10] / [.B10] -> 13.202641
A11: MERRY | B11: 1000 | C11: 8716.636 | E11: of:=[.C11] / [.B11] -> 8.716636
A12: APACHE | B12: 10000 | C12: 156988.91 | E12: of:=[.C12] / [.B12] -> 15.698891
A13: FASTUTIL | B13: 10000 | C13: 68709.41 | E13: of:=[.C13] / [.B13] -> 6.870941
A14: GDX | B14: 10000 | C14: 132434.85 | E14: of:=[.C14] / [.B14] -> 13.243485
A15: JDK | B15: 10000 | C15: 127795.372 | E15: of:=[.C15] / [.B15] -> 12.7795372
A16: MERRY | B16: 10000 | C16: 93247.453 | E16: of:=[.C16] / [.B16] -> 9.3247453
A17: APACHE | B17: 100000 | C17: 1428713.337 | E17: of:=[.C17] / [.B17] -> 14.28713337
A18: FASTUTIL | B18: 100000 | C18: 687126.688 | E18: of:=[.C18] / [.B18] -> 6.87126688
A19: GDX | B19: 100000 | C19: 1308415.285 | E19: of:=[.C19] / [.B19] -> 13.08415285
A20: JDK | B20: 100000 | C20: 1196771.408 | E20: of:=[.C20] / [.B20] -> 11.96771408
A21: MERRY | B21: 100000 | C21: 867799.608 | E21: of:=[.C21] / [.B21] -> 8.67799608
A22: APACHE | B22: 1000000 | C22: 14311544.186 | E22: of:=[.C22] / [.B22] -> 14.311544186
A23: FASTUTIL | B23: 1000000 | C23: 6910462.707 | E23: of:=[.C23] / [.B23] -> 6.910462707
A24: GDX | B24: 1000000 | C24: 14626064.24 | E24: of:=[.C24] / [.B24] -> 14.62606424
A25: JDK | B25: 1000000 | C25: 12158165.402 | E25: of:=[.C25] / [.B25] -> 12.158165402
A26: MERRY | B26: 1000000 | C26: 7724004.665 | E26: of:=[.C26] / [.B26] -> 7.724004665

Sheet: CONTAINS
A1: Implementation | B1: Iterations | C1: Time per op | E1: Time per iter | H1: 100 | I1: 1K | J1: 10K | K1: 100K | L1: 1M
A2: APACHE | B2: 100 | C2: 462.17 | E2: of:=[.C2] / [.B2] -> 4.6217 | G2: APACHE | H2: of:=[.E2] -> 4.6217 | I2: of:=[.E7] -> 4.148272 | J2: of:=[.E12] -> 4.1310742 | K2: of:=[.E17] -> 4.38987115 | L2: of:=[.E22] -> 5.002214758
A3: FASTUTIL | B3: 100 | C3: 371.897 | E3: of:=[.C3] / [.B3] -> 3.71897 | G3: FASTUTIL | H3: of:=[.E3] -> 3.71897 | I3: of:=[.E8] -> 3.580258 | J3: of:=[.E13] -> 3.3501164 | K3: of:=[.E18] -> 3.35080704 | L3: of:=[.E23] -> 3.337043114
A4: GDX | B4: 100 | C4: 313.472 | E4: of:=[.C4] / [.B4] -> 3.13472 | G4: GDX | H4: of:=[.E4] -> 3.13472 | I4: of:=[.E9] -> 3.076122 | J4: of:=[.E14] -> 2.9743693 | K4: of:=[.E19] -> 2.97137626 | L4: of:=[.E24] -> 2.977371637
A5: JDK | B5: 100 | C5: 422.488 | E5: of:=[.C5] / [.B5] -> 4.22488 | G5: JDK | H5: of:=[.E5] -> 4.22488 | I5: of:=[.E10] -> 3.631102 | J5: of:=[.E15] -> 3.5971492 | K5: of:=[.E20] -> 3.68345039 | L5: of:=[.E25] -> 4.147191247
A6: MERRY | B6: 100 | C6: 373.295 | E6: of:=[.C6] / [.B6] -> 3.73295 | G6: MERRY | H6: of:=[.E6] -> 3.73295 | I6: of:=[.E11] -> 3.748467 | J6: of:=[.E16] -> 3.7390044 | K6: of:=[.E21] -> 3.49633853 | L6: of:=[.E26] -> 3.49125098
A7: APACHE | B7: 1000 | C7: 4148.272 | E7: of:=[.C7] / [.B7] -> 4.148272
A8: FASTUTIL | B8: 1000 | C8: 3580.258 | E8: of:=[.C8] / [.B8] -> 3.580258
A9: GDX | B9: 1000 | C9: 3076.122 | E9: of:=[.C9] / [.B9] -> 3.076122
A10: JDK | B10: 1000 | C10: 3631.102 | E10: of:=[.C10] / [.B10] -> 3.631102
A11: MERRY | B11: 1000 | C11: 3748.467 | E11: of:=[.C11] / [.B11] -> 3.748467
A12: APACHE | B12: 10000 | C12: 41310.742 | E12: of:=[.C12] / [.B12] -> 4.1310742
A13: FASTUTIL | B13: 10000 | C13: 33501.164 | E13: of:=[.C13] / [.B13] -> 3.3501164
A14: GDX | B14: 10000 | C14: 29743.693 | E14: of:=[.C14] / [.B14] -> 2.9743693
A15: JDK | B15: 10000 | C15: 35971.492 | E15: of:=[.C15] / [.B15] -> 3.5971492
A16: MERRY | B16: 10000 | C16: 37390.044 | E16: of:=[.C16] / [.B16] -> 3.7390044
A17: APACHE | B17: 100000 | C17: 438987.115 | E17: of:=[.C17] / [.B17] -> 4.38987115
A18: FASTUTIL | B18: 100000 | C18: 335080.704 | E18: of:=[.C18] / [.B18] -> 3.35080704
A19: GDX | B19: 100000 | C19: 297137.626 | E19: of:=[.C19] / [.B19] -> 2.97137626
A20: JDK | B20: 100000 | C20: 368345.039 | E20: of:=[.C20] / [.B20] -> 3.68345039
A21: MERRY | B21: 100000 | C21: 349633.853 | E21: of:=[.C21] / [.B21] -> 3.49633853
A22: APACHE | B22: 1000000 | C22: 5002214.758 | E22: of:=[.C22] / [.B22] -> 5.002214758
A23: FASTUTIL | B23: 1000000 | C23: 3337043.114 | E23: of:=[.C23] / [.B23] -> 3.337043114
A24: GDX | B24: 1000000 | C24: 2977371.637 | E24: of:=[.C24] / [.B24] -> 2.977371637
A25: JDK | B25: 1000000 | C25: 4147191.247 | E25: of:=[.C25] / [.B25] -> 4.147191247
A26: MERRY | B26: 1000000 | C26: 3491250.98 | E26: of:=[.C26] / [.B26] -> 3.49125098

Sheet: REMOVE
A1: Implementation | B1: Iterations | C1: Time per op | E1: Time per iter | H1: 100 | I1: 1K | J1: 10K | K1: 100K | L1: 1M
A2: APACHE | B2: 100 | C2: 531.064 | E2: of:=[.C2] / [.B2] -> 5.31064 | G2: APACHE | H2: of:=[.E2] -> 5.31064 | I2: of:=[.E7] -> 4.800323 | J2: of:=[.E12] -> 4.7593153 | K2: of:=[.E17] -> 4.70074299 | L2: of:=[.E22] -> 4.783190094
A3: FASTUTIL | B3: 100 | C3: 565.757 | E3: of:=[.C3] / [.B3] -> 5.65757 | G3: FASTUTIL | H3: of:=[.E3] -> 5.65757 | I3: of:=[.E8] -> 4.734079 | J3: of:=[.E13] -> 4.8046828 | K3: of:=[.E18] -> 4.07077684 | L3: of:=[.E23] -> 2.514481532
A4: GDX | B4: 100 | C4: 865.767 | E4: of:=[.C4] / [.B4] -> 8.65767 | G4: GDX | H4: of:=[.E4] -> 8.65767 | I4: of:=[.E9] -> 8.092462 | J4: of:=[.E14] -> 9.6749787 | K4: of:=[.E19] -> 8.42385174 | L4: of:=[.E24] -> 8.680733493
A5: JDK | B5: 100 | C5: 312.391 | E5: of:=[.C5] / [.B5] -> 3.12391 | G5: JDK | H5: of:=[.E5] -> 3.12391 | I5: of:=[.E10] -> 2.670492 | J5: of:=[.E15] -> 2.6979173 | K5: of:=[.E20] -> 3.17003502 | L5: of:=[.E25] -> 3.153297126
A6: MERRY | B6: 100 | C6: 423.336 | E6: of:=[.C6] / [.B6] -> 4.23336 | G6: MERRY | H6: of:=[.E6] -> 4.23336 | I6: of:=[.E11] -> 3.958765 | J6: of:=[.E16] -> 3.7905128 | K6: of:=[.E21] -> 6.40816548 | L6: of:=[.E26] -> 5.189999481
A7: APACHE | B7: 1000 | C7: 4800.323 | E7: of:=[.C7] / [.B7] -> 4.800323
A8: FASTUTIL | B8: 1000 | C8: 4734.079 | E8: of:=[.C8] / [.B8] -> 4.734079
A9: GDX | B9: 1000 | C9: 8092.462 | E9: of:=[.C9] / [.B9] -> 8.092462
A10: JDK | B10: 1000 | C10: 2670.492 | E10: of:=[.C10] / [.B10] -> 2.670492
A11: MERRY | B11: 1000 | C11: 3958.765 | E11: of:=[.C11] / [.B11] -> 3.958765
A12: APACHE | B12: 10000 | C12: 47593.153 | E12: of:=[.C12] / [.B12] -> 4.7593153
A13: FASTUTIL | B13: 10000 | C13: 48046.828 | E13: of:=[.C13] / [.B13] -> 4.8046828
A14: GDX | B14: 10000 | C14: 96749.787 | E14: of:=[.C14] / [.B14] -> 9.6749787
A15: JDK | B15: 10000 | C15: 26979.173 | E15: of:=[.C15] / [.B15] -> 2.6979173
A16: MERRY | B16: 10000 | C16: 37905.128 | E16: of:=[.C16] / [.B16] -> 3.7905128
A17: APACHE | B17: 100000 | C17: 470074.299 | E17: of:=[.C17] / [.B17] -> 4.70074299
A18: FASTUTIL | B18: 100000 | C18: 407077.684 | E18: of:=[.C18] / [.B18] -> 4.07077684
A19: GDX | B19: 100000 | C19: 842385.174 | E19: of:=[.C19] / [.B19] -> 8.42385174
A20: JDK | B20: 100000 | C20: 317003.502 | E20: of:=[.C20] / [.B20] -> 3.17003502
A21: MERRY | B21: 100000 | C21: 640816.548 | E21: of:=[.C21] / [.B21] -> 6.40816548
A22: APACHE | B22: 1000000 | C22: 4783190.094 | E22: of:=[.C22] / [.B22] -> 4.783190094
A23: FASTUTIL | B23: 1000000 | C23: 2514481.532 | E23: of:=[.C23] / [.B23] -> 2.514481532
A24: GDX | B24: 1000000 | C24: 8680733.493 | E24: of:=[.C24] / [.B24] -> 8.680733493
A25: JDK | B25: 1000000 | C25: 3153297.126 | E25: of:=[.C25] / [.B25] -> 3.153297126
A26: MERRY | B26: 1000000 | C26: 5189999.481 | E26: of:=[.C26] / [.B26] -> 5.189999481

Sheet: REMOVE_THEN_ADD
A1: Implementation | B1: Iterations | C1: Time per op | E1: Time per iter | H1: 100 | I1: 1K | J1: 10K | K1: 100K | L1: 1M
A2: APACHE | B2: 100 | C2: 1291.191 | E2: of:=[.C2] / [.B2] -> 12.91191 | G2: APACHE | H2: of:=[.E2] -> 12.91191 | I2: of:=[.E7] -> 12.928036 | J2: of:=[.E12] -> 16.6241941 | K2: of:=[.E17] -> 15.05449322 | L2: of:=[.E22] -> 15.110174828
A3: FASTUTIL | B3: 100 | C3: 953.888 | E3: of:=[.C3] / [.B3] -> 9.53888 | G3: FASTUTIL | H3: of:=[.E3] -> 9.53888 | I3: of:=[.E8] -> 6.953846 | J3: of:=[.E13] -> 6.8880251 | K3: of:=[.E18] -> 6.63430505 | L3: of:=[.E23] -> 6.936482609
A4: GDX | B4: 100 | C4: 1318.744 | E4: of:=[.C4] / [.B4] -> 13.18744 | G4: GDX | H4: of:=[.E4] -> 13.18744 | I4: of:=[.E9] -> 11.269477 | J4: of:=[.E14] -> 13.3813434 | K4: of:=[.E19] -> 13.06083847 | L4: of:=[.E24] -> 13.561394323
A5: JDK | B5: 100 | C5: 1229.129 | E5: of:=[.C5] / [.B5] -> 12.29129 | G5: JDK | H5: of:=[.E5] -> 12.29129 | I5: of:=[.E10] -> 10.760441 | J5: of:=[.E15] -> 9.8203617 | K5: of:=[.E20] -> 12.15634867 | L5: of:=[.E25] -> 12.398786404
A6: MERRY | B6: 100 | C6: 865.591 | E6: of:=[.C6] / [.B6] -> 8.65591 | G6: MERRY | H6: of:=[.E6] -> 8.65591 | I6: of:=[.E11] -> 8.694127 | J6: of:=[.E16] -> 8.6408041 | K6: of:=[.E21] -> 8.96117619 | L6: of:=[.E26] -> 8.905287586
A7: APACHE | B7: 1000 | C7: 12928.036 | E7: of:=[.C7] / [.B7] -> 12.928036
A8: FASTUTIL | B8: 1000 | C8: 6953.846 | E8: of:=[.C8] / [.B8] -> 6.953846
A9: GDX | B9: 1000 | C9: 11269.477 | E9: of:=[.C9] / [.B9] -> 11.269477
A10: JDK | B10: 1000 | C10: 10760.441 | E10: of:=[.C10] / [.B10] -> 10.760441
A11: MERRY | B11: 1000 | C11: 8694.127 | E11: of:=[.C11] / [.B11] -> 8.694127
A12: APACHE | B12: 10000 | C12: 166241.941 | E12: of:=[.C12] / [.B12] -> 16.6241941
A13: FASTUTIL | B13: 10000 | C13: 68880.251 | E13: of:=[.C13] / [.B13] -> 6.8880251
A14: GDX | B14: 10000 | C14: 133813.434 | E14: of:=[.C14] / [.B14] -> 13.3813434
A15: JDK | B15: 10000 | C15: 98203.617 | E15: of:=[.C15] / [.B15] -> 9.8203617
A16: MERRY | B16: 10000 | C16: 86408.041 | E16: of:=[.C16] / [.B16] -> 8.6408041
A17: APACHE | B17: 100000 | C17: 1505449.322 | E17: of:=[.C17] / [.B17] -> 15.05449322
A18: FASTUTIL | B18: 100000 | C18: 663430.505 | E18: of:=[.C18] / [.B18] -> 6.63430505
A19: GDX | B19: 100000 | C19: 1306083.847 | E19: of:=[.C19] / [.B19] -> 13.06083847
A20: JDK | B20: 100000 | C20: 1215634.867 | E20: of:=[.C20] / [.B20] -> 12.15634867
A21: MERRY | B21: 100000 | C21: 896117.619 | E21: of:=[.C21] / [.B21] -> 8.96117619
A22: APACHE | B22: 1000000 | C22: 15110174.828 | E22: of:=[.C22] / [.B22] -> 15.110174828
A23: FASTUTIL | B23: 1000000 | C23: 6936482.609 | E23: of:=[.C23] / [.B23] -> 6.936482609
A24: GDX | B24: 1000000 | C24: 13561394.323 | E24: of:=[.C24] / [.B24] -> 13.561394323
A25: JDK | B25: 1000000 | C25: 12398786.404 | E25: of:=[.C25] / [.B25] -> 12.398786404
A26: MERRY | B26: 1000000 | C26: 8905287.586 | E26: of:=[.C26] / [.B26] -> 8.905287586

Sheet: Sheet7
A1: APACHE | B1: 100 | C1: 1177.624 | D1: ADD | E1: 1177.624
A2: FASTUTIL | B2: 100 | C2: 434.528 | D2: ADD | E2: 434.528
A3: GDX | B3: 100 | C3: 377.24 | D3: ADD | E3: 377.24
A4: JDK | B4: 100 | C4: 723.624 | D4: ADD | E4: 723.624
A5: MERRY | B5: 100 | C5: 445.613 | D5: ADD | E5: 445.613
A6: APACHE | B6: 1000 | C6: 11007.263 | D6: ADD | E6: 11007.263
A7: FASTUTIL | B7: 1000 | C7: 4264.447 | D7: ADD | E7: 4264.447
A8: GDX | B8: 1000 | C8: 2889.235 | D8: ADD | E8: 2889.235
A9: JDK | B9: 1000 | C9: 6299.871 | D9: ADD | E9: 6299.871
A10: MERRY | B10: 1000 | C10: 3785.805 | D10: ADD | E10: 3785.805
A11: APACHE | B11: 10000 | C11: 110063.122 | D11: ADD | E11: 110063.122
A12: FASTUTIL | B12: 10000 | C12: 42670.11 | D12: ADD | E12: 42670.11
A13: GDX | B13: 10000 | C13: 28346.13 | D13: ADD | E13: 28346.13
A14: JDK | B14: 10000 | C14: 80288.279 | D14: ADD | E14: 80288.279
A15: MERRY | B15: 10000 | C15: 37937.102 | D15: ADD | E15: 37937.102
A16: APACHE | B16: 100000 | C16: 959624.603 | D16: ADD | E16: 959624.603
A17: FASTUTIL | B17: 100000 | C17: 427692.553 | D17: ADD | E17: 427692.553
A18: GDX | B18: 100000 | C18: 283161.363 | D18: ADD | E18: 283161.363
A19: JDK | B19: 100000 | C19: 899119.476 | D19: ADD | E19: 899119.476
A20: MERRY | B20: 100000 | C20: 379045.655 | D20: ADD | E20: 379045.655
A21: APACHE | B21: 1000000 | C21: 9766217.392 | D21: ADD | E21: 9766217.392
A22: FASTUTIL | B22: 1000000 | C22: 4370183.559 | D22: ADD | E22: 4370183.559
A23: GDX | B23: 1000000 | C23: 5551540.536 | D23: ADD | E23: 5551540.536
A24: JDK | B24: 1000000 | C24: 9037354.32 | D24: ADD | E24: 9037354.32
A25: MERRY | B25: 1000000 | C25: 3783858.704 | D25: ADD | E25: 3783858.704
A26: APACHE | B26: 100 | C26: 1270.078 | D26: ADD_OR_REMOVE | E26: 1270.078
A27: FASTUTIL | B27: 100 | C27: 574.464 | D27: ADD_OR_REMOVE | E27: 574.464
A28: GDX | B28: 100 | C28: 989.49 | D28: ADD_OR_REMOVE | E28: 989.49
A29: JDK | B29: 100 | C29: 1093.977 | D29: ADD_OR_REMOVE | E29: 1093.977
A30: MERRY | B30: 100 | C30: 843.057 | D30: ADD_OR_REMOVE | E30: 843.057
A31: APACHE | B31: 1000 | C31: 12572.251 | D31: ADD_OR_REMOVE | E31: 12572.251
A32: FASTUTIL | B32: 1000 | C32: 4837.264 | D32: ADD_OR_REMOVE | E32: 4837.264
A33: GDX | B33: 1000 | C33: 9433.485 | D33: ADD_OR_REMOVE | E33: 9433.485
A34: JDK | B34: 1000 | C34: 11121.696 | D34: ADD_OR_REMOVE | E34: 11121.696
A35: MERRY | B35: 1000 | C35: 7762.848 | D35: ADD_OR_REMOVE | E35: 7762.848
A36: APACHE | B36: 10000 | C36: 119350.653 | D36: ADD_OR_REMOVE | E36: 119350.653
A37: FASTUTIL | B37: 10000 | C37: 48894.288 | D37: ADD_OR_REMOVE | E37: 48894.288
A38: GDX | B38: 10000 | C38: 99132.867 | D38: ADD_OR_REMOVE | E38: 99132.867
A39: JDK | B39: 10000 | C39: 114451.924 | D39: ADD_OR_REMOVE | E39: 114451.924
A40: MERRY | B40: 10000 | C40: 83146.546 | D40: ADD_OR_REMOVE | E40: 83146.546
A41: APACHE | B41: 100000 | C41: 1068447.954 | D41: ADD_OR_REMOVE | E41: 1068447.954
A42: FASTUTIL | B42: 100000 | C42: 491061.993 | D42: ADD_OR_REMOVE | E42: 491061.993
A43: GDX | B43: 100000 | C43: 926482.571 | D43: ADD_OR_REMOVE | E43: 926482.571
A44: JDK | B44: 100000 | C44: 1013259.05 | D44: ADD_OR_REMOVE | E44: 1013259.05
A45: MERRY | B45: 100000 | C45: 832547.099 | D45: ADD_OR_REMOVE | E45: 832547.099
A46: APACHE | B46: 1000000 | C46: 10666841.134 | D46: ADD_OR_REMOVE | E46: 10666841.134
A47: FASTUTIL | B47: 1000000 | C47: 4881426.292 | D47: ADD_OR_REMOVE | E47: 4881426.292
A48: GDX | B48: 1000000 | C48: 9183054.619 | D48: ADD_OR_REMOVE | E48: 9183054.619
A49: JDK | B49: 1000000 | C49: 10726491.767 | D49: ADD_OR_REMOVE | E49: 10726491.767
A50: MERRY | B50: 1000000 | C50: 7714578.056 | D50: ADD_OR_REMOVE | E50: 7714578.056
A51: APACHE | B51: 100 | C51: 1510.37 | D51: ADD_THEN_REMOVE | E51: 1510.37
A52: FASTUTIL | B52: 100 | C52: 792.866 | D52: ADD_THEN_REMOVE | E52: 792.866
A53: GDX | B53: 100 | C53: 1215.016 | D53: ADD_THEN_REMOVE | E53: 1215.016
A54: JDK | B54: 100 | C54: 1478.631 | D54: ADD_THEN_REMOVE | E54: 1478.631
A55: MERRY | B55: 100 | C55: 879.191 | D55: ADD_THEN_REMOVE | E55: 879.191
A56: APACHE | B56: 1000 | C56: 12415.744 | D56: ADD_THEN_REMOVE | E56: 12415.744
A57: FASTUTIL | B57: 1000 | C57: 6902.072 | D57: ADD_THEN_REMOVE | E57: 6902.072
A58: GDX | B58: 1000 | C58: 11463.256 | D58: ADD_THEN_REMOVE | E58: 11463.256
A59: JDK | B59: 1000 | C59: 13202.641 | D59: ADD_THEN_REMOVE | E59: 13202.641
A60: MERRY | B60: 1000 | C60: 8716.636 | D60: ADD_THEN_REMOVE | E60: 8716.636
A61: APACHE | B61: 10000 | C61: 156988.91 | D61: ADD_THEN_REMOVE | E61: 156988.91
A62: FASTUTIL | B62: 10000 | C62: 68709.41 | D62: ADD_THEN_REMOVE | E62: 68709.41
A63: GDX | B63: 10000 | C63: 132434.85 | D63: ADD_THEN_REMOVE | E63: 132434.85
A64: JDK | B64: 10000 | C64: 127795.372 | D64: ADD_THEN_REMOVE | E64: 127795.372
A65: MERRY | B65: 10000 | C65: 93247.453 | D65: ADD_THEN_REMOVE | E65: 93247.453
A66: APACHE | B66: 100000 | C66: 1428713.337 | D66: ADD_THEN_REMOVE | E66: 1428713.337
A67: FASTUTIL | B67: 100000 | C67: 687126.688 | D67: ADD_THEN_REMOVE | E67: 687126.688
A68: GDX | B68: 100000 | C68: 1308415.285 | D68: ADD_THEN_REMOVE | E68: 1308415.285
A69: JDK | B69: 100000 | C69: 1196771.408 | D69: ADD_THEN_REMOVE | E69: 1196771.408
A70: MERRY | B70: 100000 | C70: 867799.608 | D70: ADD_THEN_REMOVE | E70: 867799.608
A71: APACHE | B71: 1000000 | C71: 14311544.186 | D71: ADD_THEN_REMOVE | E71: 14311544.186
A72: FASTUTIL | B72: 1000000 | C72: 6910462.707 | D72: ADD_THEN_REMOVE | E72: 6910462.707
A73: GDX | B73: 1000000 | C73: 14626064.24 | D73: ADD_THEN_REMOVE | E73: 14626064.24
A74: JDK | B74: 1000000 | C74: 12158165.402 | D74: ADD_THEN_REMOVE | E74: 12158165.402
A75: MERRY | B75: 1000000 | C75: 7724004.665 | D75: ADD_THEN_REMOVE | E75: 7724004.665
A76: APACHE | B76: 100 | C76: 462.17 | D76: CONTAINS | E76: 462.17
A77: FASTUTIL | B77: 100 | C77: 371.897 | D77: CONTAINS | E77: 371.897
A78: GDX | B78: 100 | C78: 313.472 | D78: CONTAINS | E78: 313.472
A79: JDK | B79: 100 | C79: 422.488 | D79: CONTAINS | E79: 422.488
A80: MERRY | B80: 100 | C80: 373.295 | D80: CONTAINS | E80: 373.295
A81: APACHE | B81: 1000 | C81: 4148.272 | D81: CONTAINS | E81: 4148.272
A82: FASTUTIL | B82: 1000 | C82: 3580.258 | D82: CONTAINS | E82: 3580.258
A83: GDX | B83: 1000 | C83: 3076.122 | D83: CONTAINS | E83: 3076.122
A84: JDK | B84: 1000 | C84: 3631.102 | D84: CONTAINS | E84: 3631.102
A85: MERRY | B85: 1000 | C85: 3748.467 | D85: CONTAINS | E85: 3748.467
A86: APACHE | B86: 10000 | C86: 41310.742 | D86: CONTAINS | E86: 41310.742
A87: FASTUTIL | B87: 10000 | C87: 33501.164 | D87: CONTAINS | E87: 33501.164
A88: GDX | B88: 10000 | C88: 29743.693 | D88: CONTAINS | E88: 29743.693
A89: JDK | B89: 10000 | C89: 35971.492 | D89: CONTAINS | E89: 35971.492
A90: MERRY | B90: 10000 | C90: 37390.044 | D90: CONTAINS | E90: 37390.044
A91: APACHE | B91: 100000 | C91: 438987.115 | D91: CONTAINS | E91: 438987.115
A92: FASTUTIL | B92: 100000 | C92: 335080.704 | D92: CONTAINS | E92: 335080.704
A93: GDX | B93: 100000 | C93: 297137.626 | D93: CONTAINS | E93: 297137.626
A94: JDK | B94: 100000 | C94: 368345.039 | D94: CONTAINS | E94: 368345.039
A95: MERRY | B95: 100000 | C95: 349633.853 | D95: CONTAINS | E95: 349633.853
A96: APACHE | B96: 1000000 | C96: 5002214.758 | D96: CONTAINS | E96: 5002214.758
A97: FASTUTIL | B97: 1000000 | C97: 3337043.114 | D97: CONTAINS | E97: 3337043.114
A98: GDX | B98: 1000000 | C98: 2977371.637 | D98: CONTAINS | E98: 2977371.637
A99: JDK | B99: 1000000 | C99: 4147191.247 | D99: CONTAINS | E99: 4147191.247
A100: MERRY | B100: 1000000 | C100: 3491250.98 | D100: CONTAINS | E100: 3491250.98
A101: APACHE | B101: 100 | C101: 531.064 | D101: REMOVE | E101: 531.064
A102: FASTUTIL | B102: 100 | C102: 565.757 | D102: REMOVE | E102: 565.757
A103: GDX | B103: 100 | C103: 865.767 | D103: REMOVE | E103: 865.767
A104: JDK | B104: 100 | C104: 312.391 | D104: REMOVE | E104: 312.391
A105: MERRY | B105: 100 | C105: 423.336 | D105: REMOVE | E105: 423.336
A106: APACHE | B106: 1000 | C106: 4800.323 | D106: REMOVE | E106: 4800.323
A107: FASTUTIL | B107: 1000 | C107: 4734.079 | D107: REMOVE | E107: 4734.079
A108: GDX | B108: 1000 | C108: 8092.462 | D108: REMOVE | E108: 8092.462
A109: JDK | B109: 1000 | C109: 2670.492 | D109: REMOVE | E109: 2670.492
A110: MERRY | B110: 1000 | C110: 3958.765 | D110: REMOVE | E110: 3958.765
A111: APACHE | B111: 10000 | C111: 47593.153 | D111: REMOVE | E111: 47593.153
A112: FASTUTIL | B112: 10000 | C112: 48046.828 | D112: REMOVE | E112: 48046.828
A113: GDX | B113: 10000 | C113: 96749.787 | D113: REMOVE | E113: 96749.787
A114: JDK | B114: 10000 | C114: 26979.173 | D114: REMOVE | E114: 26979.173
A115: MERRY | B115: 10000 | C115: 37905.128 | D115: REMOVE | E115: 37905.128
A116: APACHE | B116: 100000 | C116: 470074.299 | D116: REMOVE | E116: 470074.299
A117: FASTUTIL | B117: 100000 | C117: 407077.684 | D117: REMOVE | E117: 407077.684
A118: GDX | B118: 100000 | C118: 842385.174 | D118: REMOVE | E118: 842385.174
A119: JDK | B119: 100000 | C119: 317003.502 | D119: REMOVE | E119: 317003.502
A120: MERRY | B120: 100000 | C120: 640816.548 | D120: REMOVE | E120: 640816.548
A121: APACHE | B121: 1000000 | C121: 4783190.094 | D121: REMOVE | E121: 4783190.094
A122: FASTUTIL | B122: 1000000 | C122: 2514481.532 | D122: REMOVE | E122: 2514481.532
A123: GDX | B123: 1000000 | C123: 8680733.493 | D123: REMOVE | E123: 8680733.493
A124: JDK | B124: 1000000 | C124: 3153297.126 | D124: REMOVE | E124: 3153297.126
A125: MERRY | B125: 1000000 | C125: 5189999.481 | D125: REMOVE | E125: 5189999.481
A126: APACHE | B126: 100 | C126: 1291.191 | D126: REMOVE_THEN_ADD | E126: 1291.191
A127: FASTUTIL | B127: 100 | C127: 953.888 | D127: REMOVE_THEN_ADD | E127: 953.888
A128: GDX | B128: 100 | C128: 1318.744 | D128: REMOVE_THEN_ADD | E128: 1318.744
A129: JDK | B129: 100 | C129: 1229.129 | D129: REMOVE_THEN_ADD | E129: 1229.129
A130: MERRY | B130: 100 | C130: 865.591 | D130: REMOVE_THEN_ADD | E130: 865.591
A131: APACHE | B131: 1000 | C131: 12928.036 | D131: REMOVE_THEN_ADD | E131: 12928.036
A132: FASTUTIL | B132: 1000 | C132: 6953.846 | D132: REMOVE_THEN_ADD | E132: 6953.846
A133: GDX | B133: 1000 | C133: 11269.477 | D133: REMOVE_THEN_ADD | E133: 11269.477
A134: JDK | B134: 1000 | C134: 10760.441 | D134: REMOVE_THEN_ADD | E134: 10760.441
A135: MERRY | B135: 1000 | C135: 8694.127 | D135: REMOVE_THEN_ADD | E135: 8694.127
A136: APACHE | B136: 10000 | C136: 166241.941 | D136: REMOVE_THEN_ADD | E136: 166241.941
A137: FASTUTIL | B137: 10000 | C137: 68880.251 | D137: REMOVE_THEN_ADD | E137: 68880.251
A138: GDX | B138: 10000 | C138: 133813.434 | D138: REMOVE_THEN_ADD | E138: 133813.434
A139: JDK | B139: 10000 | C139: 98203.617 | D139: REMOVE_THEN_ADD | E139: 98203.617
A140: MERRY | B140: 10000 | C140: 86408.041 | D140: REMOVE_THEN_ADD | E140: 86408.041
A141: APACHE | B141: 100000 | C141: 1505449.322 | D141: REMOVE_THEN_ADD | E141: 1505449.322
A142: FASTUTIL | B142: 100000 | C142: 663430.505 | D142: REMOVE_THEN_ADD | E142: 663430.505
A143: GDX | B143: 100000 | C143: 1306083.847 | D143: REMOVE_THEN_ADD | E143: 1306083.847
A144: JDK | B144: 100000 | C144: 1215634.867 | D144: REMOVE_THEN_ADD | E144: 1215634.867
A145: MERRY | B145: 100000 | C145: 896117.619 | D145: REMOVE_THEN_ADD | E145: 896117.619
A146: APACHE | B146: 1000000 | C146: 15110174.828 | D146: REMOVE_THEN_ADD | E146: 15110174.828
A147: FASTUTIL | B147: 1000000 | C147: 6936482.609 | D147: REMOVE_THEN_ADD | E147: 6936482.609
A148: GDX | B148: 1000000 | C148: 13561394.323 | D148: REMOVE_THEN_ADD | E148: 13561394.323
A149: JDK | B149: 1000000 | C149: 12398786.404 | D149: REMOVE_THEN_ADD | E149: 12398786.404
A150: MERRY | B150: 1000000 | C150: 8905287.586 | D150: REMOVE_THEN_ADD | E150: 8905287.586